video_id,title,channel_title,category_id,tags,views,likes,dislikes,description,trending_date,publish_time,text,date_diff
a8v__0kHzNg,Avengers : Infinity War - Première bande-annonce (VOST),Marvel FR,1,"Marvel|""avengers infinity war""|""avengers 4""|""bande-annonce""|""teaser""|""première bande-annonce""|""iron man""|""star lord""|""captain america""|""thor""|""black widow""|""thanos""|""spider-man""|""spiderman""|""doctor strange""|""wanda""|""hulk""|""gamaora""|""clint""|""loki""|""nebula""|""groot""|""drax""|""vision""|""Robert downey Jr""|""Chris Pratt""|""Chris Evans""|""Chris Hemsworth""|""Tom Holland""|""Benedict Cumberbatch""|""Zoe Saldana""|""Vin Diesel""|""Stan Lee""|""Dave Bautista""|""Benicio del Toro""|""tom hiddleston""|""french""|""en français""|""vostfr""|""vost""",1129281,20421,543,"Tout a mené à cet instant. Découvrez la première bande-annonce d’Avengers : Infinity War en VOST !\n\nAvengers : Infinity War, dès le 25 avril 2018 au cinéma.\n\nRetrouvez toute l'actualité du Studio Marvel:\n- sur Facebook : http://facebook.com/MarvelFR\n- sur Twitter : http://twitter.com/MarvelFR",2017-11-30,2017-11-29,Avengers Infinity War Premi re bande annonce VOST Tout men cet instant couvrez la premi re bande annonce Avengers Infinity War en VOST n nAvengers Infinity War s le avril au cin ma nRetrouvez toute actualit du Studio Marvel sur Facebook sur Twitter Marvel avengers infinity war avengers bande annonce teaser premi re bande annonce iron man star lord captain america thor black widow thanos spider man spiderman doctor strange wanda hulk gamaora clint loki nebula groot drax vision Robert downey Jr Chris Pratt Chris Evans Chris Hemsworth Tom Holland Benedict Cumberbatch Zoe Saldana Vin Diesel Stan Lee Dave Bautista Benicio del Toro tom hiddleston french en fran ais vostfr vost,10
dfnCAmr569k,"Taylor Swift - End Game ft. Ed Sheeran, Future",TaylorSwiftVEVO,10,"Taylor|""Swift""|""End""|""Game""|""Big""|""Machine""|""Pop""",64498997,2325669,135048,"Music video by Taylor Swift performing End Game. (C) 2018 Big Machine Label Group, LLC\n\nhttp://vevo.ly/YQbdEJ",2018-01-13,2018-01-12,Taylor Swift End Game ft Ed Sheeran Future Music video by Taylor Swift performing End Game C Big Machine Label Group LLC n Taylor Swift End Game Big Machine Pop,10
ApuZdbeb54I,Balti -  Khalini Nrou9 (Official Music Video),Thisiz Balti,10,"Khalini Nrou9|""خليني نروق""|""Balti""|""thisizbalti""|""rap""|""بلطي""|""rap tunisien""|""tunisie""|""tunisian""|""rap tounsi""|""baltiroshima""|""dragon balti""|""بلتي""|""راب""|""تونس""|""artiste tunisien""|""khalini nrou2""|""balti 2018""|""new balti""|""rapping""",5670777,126328,7371,Balti -  Khalini Nrou9 | خليني نروق\n\n\nMixage & Mastering: Hbibzgang\nVideo Production: Balti\nRéalisation: Mohamed Missaoui\n\nChaine officielle de Balti\n\nFacebook: http://www.facebook.com/thisizbalti\nInstagram: https://www.instagram.com/thisizbalti\n http://www.thisizbalti.com\n\n\nDigital Distribution: CHBK Music,2018-03-11,2018-03-10,Balti Khalini Nrou Official Music Video Balti Khalini Nrou n nMixage Mastering Hbibzgang nVideo Production Balti nR alisation Mohamed Missaoui nChaine officielle de Balti nFacebook Distribution CHBK Music Khalini Nrou Balti thisizbalti rap rap tunisien tunisie tunisian rap tounsi baltiroshima dragon balti artiste tunisien khalini nrou balti new balti rapping,10
eRsRIgepQtM,"Kaaris - Bling Bling ft. Kalash Criminel, Sofiane",KaarisOfficielVEVO,10,"Kaaris|""Bling""|""Def""|""Jam""|""Recordings""|""France""|""Rap""|""talsadoum""|""talsadoum double fuck""|""Karis""|""XVBarbar""|""Terrain""|""Terain""|""Double Fuck""|""petit vélo""|""Sinaloa""|""C'est la base""|""Mixtape""|""Kadirov""|""K2ARIS""|""80 ZETREI""|""Comme Gucci Mane""|""Gucci Mane""|""Gucci""|""Sevrak""|""Se-Vrak""|""Chiraq""|""Chirak""|""remix""|""Therapy""|""Therapy music""|""sevran""|""BTTF""|""back to the future""|""K2A""|""Booba""|""B2O""|""zoo""|""marvel""|""monte à bord""|""pris pour cible""|""becken power""|""def jam""|""or noir""",6481640,150438,7893,"Nouveau titre « Bling Bling » , extrait du nouvel album « DOZO » disponible → http://kaaris.lnk.to/Dozo\nAbonne-toi à la chaîne → http://po.st/KaarisVEVO \nComposé par Double X\nRéalisé par Cedrick Cayla\n\nRetrouvez Kaaris sur :\nhttp://www.kaaris-officiel.fr\nFacebook: https://www.facebook.com/Kaaris.Officiel\nTwitter: https://twitter.com/KaarisOfficiel1 \nInstagram: http://instagram.com/kaarisofficiel1\nSnapchat : https://www.snapchat.com/add/zongoledozo27\n\nMusic video by Kaaris performing Bling Bling. (C) 2017 Def Jam Recordings France\n\nhttp://vevo.ly/nNv9df",2017-12-01,2017-11-30,Kaaris Bling Bling ft Kalash Criminel Sofiane Nouveau titre Bling Bling extrait du nouvel album DOZO disponible la cha ne nCompos par Double nR alis par Cedrick Cayla nRetrouvez Kaaris sur n nInstagram video by Kaaris performing Bling Bling C Def Jam Recordings France n Kaaris Bling Def Jam Recordings France Rap talsadoum talsadoum double fuck Karis XVBarbar Terrain Terain Double Fuck petit lo Sinaloa C est la base Mixtape Kadirov K ARIS ZETREI Comme Gucci Mane Gucci Mane Gucci Sevrak Se Vrak Chiraq Chirak remix Therapy Therapy music sevran BTTF back to the future K Booba B zoo marvel monte bord pris pour cible becken power def jam or noir,10
ox7RsX1Ee34,Kendrick Lamar - LOVE. ft. Zacari,KendrickLamarVEVO,10,"Kendrick|""Lamar""|""LOVE.""|""Top""|""Dawg""|""Entertainment/Aftermath""|""Records/""|""Interscope""|""Records""|""Hip""|""Hop""|""Damn""|""Zacari""|""Love""",23419305,871386,17535,"DAMN. available now http://smarturl.it/DAMN\n \nBest of Kendrick Lamar https://goo.gl/PTr3FF\nKendrick Lamar - Damn https://goo.gl/6XEm55\nSubscribe for more https://goo.gl/XGVyCd\n \nVideo Director: Dave Meyers and the little homies\nVideo Producer: Nathan Scherrer\nfor Freenjoy, Inc\n\nMusic video by Kendrick Lamar performing LOVE.. (C) 2017 Aftermath/Interscope (Top Dawg Entertainment)\n\nhttp://vevo.ly/9ECgU5",2017-12-22,2017-12-22,Kendrick Lamar LOVE ft Zacari DAMN available now nBest of Kendrick Lamar Lamar Damn for more nVideo Director Dave Meyers and the little homies nVideo Producer Nathan Scherrer nfor Freenjoy Inc nMusic video by Kendrick Lamar performing LOVE Aftermath Interscope Top Dawg Entertainment n Kendrick Lamar LOVE Top Dawg Entertainment Aftermath Records Interscope Records Hip Hop Damn Zacari Love,10
Ii3V6PJDicE,Serious Injury Kylian Mbappe Paris Saint-Germain VS Olympique Lyonnais!!!!,Mstf skills HD,17,FOOTBALL,305168,544,291,FACEBOOK:https://www.facebook.com/Mstf-skills-HD-513691715470927/\nYOUTUBE:https://www.youtube.com/channel/UCN3LqA-jNc2r_pWEuK9cQ0g\nPAYPAL:https://www.paypal.me/Mstfskillshd\nINSTAGRAM:https://www.instagram.com/hdmstfskills/\nthanks for watching,2018-01-22,2018-01-21,Serious Injury Kylian Mbappe Paris Saint Germain VS Olympique Lyonnais FACEBOOK for watching FOOTBALL,10
9zP6OQcQa3k,UNWIN FAIT UNE FACECAM SI IL PERD !,MoKeY,24,"Unwin|""Unwin irl""|""facecam""|""foot""|""football""|""mokey""|""délires""|""fun""|""TeamLaSalle""|""Aidenshow""|""LaSalle""|""foot avec unwin""|""unwin facecam""",597926,22587,2657,Onefootball : http://bit.do/mokey\n\n► Clique ici pour t'abonner : http://bit.ly/28K3q3m\n\n►Twitter : @MokeyGTAV\n►Instagram :  https://www.instagram.com/mokey_54/\n►Facebook : MokeyGTA5\n► Snap : mokeysnap\n\nVidéo sponsorisée,2017-12-03,2017-12-02,UNWIN FAIT UNE FACECAM SI IL PERD Onefootball Clique ici pour abonner Twitter Instagram Facebook MokeyGTA Snap mokeysnap nVid sponsoris Unwin Unwin irl facecam foot football mokey d lires fun TeamLaSalle Aidenshow LaSalle foot avec unwin unwin facecam,10
awCGlJSoNEM,Lyon vs PSG 2-1 All Goals & Highlights 21/01/2018,Soccer highlights,17,[none],584066,3843,178,nan,2018-01-22,2018-01-21,Lyon vs PSG All Goals Highlights nan none,10
WS7f5xpGYn8,Katy Perry - Hey Hey Hey (Official),KatyPerryVEVO,10,"katy perry|""hey hey hey""|""official""|""music video""|""witness""|""can't break me""",41293992,1221381,259819,"Get Hey Hey Hey from Katy's new album 'Witness': http://katy.to/WitnessYd\nWITNESS: The Tour tickets available now! https://www.katyperry.com/tour\n\nDirected by Isaac Rentz\nProduced by Nina Dluhy-Miller & Danny Lockwood\n\nLyrics:\nA big beautiful brain with a pretty face, yeah\nA babydoll with a briefcase, yeah\nA hot little hurricane, ha\n'Cause I'm feminine and soft, but I'm still a boss, yeah\nRed lipstick but still so raw, yeah\nMarilyn Monroe in a monster truck\n\n'Cause I can be zen, and I can be the storm, yeah\nSmell like a rose, and I pierce like a thorn, yeah\nKarate chopping the clichés and norms all in a dress\n\nHey, hey, hey\nYou think that I'm a little baby\nYou think that I am fragile like a Fabergé\nYou think that I am cracking, but you can't break me\nNo, no way\nNo, no way\nNo, no way\nYou think that I am cracking, but you can't break me (break me)\n\nYeah, I bounce back like a pro 'cause I'm so resilient\nL-o-l at all your limits\nKeep your penny thoughts, I'm making a mint\n\n'Cause I can be zen, and I can be the storm, yeah\nSmell like a rose, and I pierce like a thorn, yeah\nKarate chopping the clichés and norms all in a dress\n\nHey, hey, hey\nYou think that I'm a little baby\nYou think that I am fragile like a Fabergé\nYou think that I am cracking, but you can't break me\nNo, no way\nNo, no way\nNo, no way\nYou think that I am cracking, but you can't break me (break me)\n\nI ain't got no strings (no strings, no strings, no strings)\nI'm no one's little puppet\nGot my own cha ching in my chubby little wallet\nAnd secretly you love it (you fucking love it)\nAnd secretly you love it\n\nHey, hey, hey\nYou think that I'm a little baby\nYou think that I am fragile like a Fabergé\nYou think that I am cracking, but you can't break me\nNo\nHey, hey, hey\nYou think that I'm a little baby\nYou think that I am fragile like a Fabergé\nYou think that I am cracking, but you can't break me\nNo, no way (no)\nNo, no way (no way)\nNo, no way (uh-uh)\nOh, you think that I am cracking, but you can't break me\n\nFollow Katy Perry:\nhttp://www.katyperry.com\nhttp://youtube.com/katyperry\nhttp://twitter.com/katyperry\nhttp://facebook.com/katyperry\nhttp://instagram.com/katyperry\n\nMusic video by Katy Perry performing Hey Hey Hey (C) 2017 Capitol Records\n\nhttp://vevo.ly/233WHW",2017-12-21,2017-12-20,Katy Perry Hey Hey Hey Official Get Hey Hey Hey from Katy new album Witness The Tour tickets available now by Isaac Rentz nProduced by Nina Dluhy Miller Danny Lockwood nLyrics nA big beautiful brain with pretty face yeah nA babydoll with briefcase yeah nA hot little hurricane ha Cause m feminine and soft but m still boss yeah nRed lipstick but still so raw yeah nMarilyn Monroe in monster truck n Cause can be zen and can be the storm yeah nSmell like rose and pierce like thorn yeah nKarate chopping the clich and norms all in dress nHey hey hey nYou think that m little baby nYou think that am fragile like Faberg nYou think that am cracking but you can break me nNo no way nNo no way nNo no way nYou think that am cracking but you can break me break me nYeah bounce back like pro cause m so resilient nL l at all your limits nKeep your penny thoughts m making mint n Cause can be zen and can be the storm yeah nSmell like rose and pierce like thorn yeah nKarate chopping the clich and norms all in dress nHey hey hey nYou think that m little baby nYou think that am fragile like Faberg nYou think that am cracking but you can break me nNo no way nNo no way nNo no way nYou think that am cracking but you can break me break me nI ain got no strings no strings no strings no strings nI no one little puppet nGot my own cha ching in my chubby little wallet nAnd secretly you love it you fucking love it nAnd secretly you love it nHey hey hey nYou think that m little baby nYou think that am fragile like Faberg nYou think that am cracking but you can break me nNo nHey hey hey nYou think that m little baby nYou think that am fragile like Faberg nYou think that am cracking but you can break me nNo no way no nNo no way no way nNo no way uh uh nOh you think that am cracking but you can break me nFollow Katy Perry video by Katy Perry performing Hey Hey Hey Capitol Records n katy perry hey hey hey official music video witness can break me,10
JuntSO0AR30,Dosseh - Papillon ft. 13 Block,DossehVEVO,10,"Dosseh|""Papillon""|""Capitol""|""Rap""|""Dosseh Papillon""|""Dosseh 13 Block""|""Dosseh 13 Block Papillon""|""Dosseh feat 13 Block""|""Dosseh Papillon 13""|""Dosseh Papillon 13 Block""|""13 Block""|""Papillon Dosseh""|""Papillon 13 Block""|""13 Block Papillon""|""13 Block Papillon Dosseh""|""13 Block Dosseh Papillon""|""13Block Papillon""|""Dosseh 13Block""|""Dosseh ft 13 Block""|""Dosseh featuring 13 Block""|""Papillon clip""|""Papillon clip officiel""|""clip official""|""official""|""video""",1198116,30693,1018,Dosseh - Papillon feat. 13 Block\nTitre disponible en streaming : https://Dosseh.lnk.to/Papillon \n\nRéalisation : Chris Macari\nProd. by Junior Alaprod\n\nRetrouvez Dosseh sur : \nFacebook : https://www.facebook.com/Dosseh45 \nTwitter : https://twitter.com/DossehLaFamine \nInstagram : http://instagram.com/dossehofficiel \nSnapchat : https://www.snapchat.com/add/NigguzInOrlinz\n\nMusic video by Dosseh performing Papillon. (C) 2018 Capitol Music France\n\nhttp://vevo.ly/GiWTsL,2018-03-17,2018-03-16,Dosseh Papillon ft Block Dosseh Papillon feat Block nTitre disponible en streaming n nR alisation Chris Macari nProd by Junior Alaprod nRetrouvez Dosseh sur nFacebook nTwitter nInstagram nSnapchat video by Dosseh performing Papillon C Capitol Music France n Dosseh Papillon Capitol Rap Dosseh Papillon Dosseh Block Dosseh Block Papillon Dosseh feat Block Dosseh Papillon Dosseh Papillon Block Block Papillon Dosseh Papillon Block Block Papillon Block Papillon Dosseh Block Dosseh Papillon Block Papillon Dosseh Block Dosseh ft Block Dosseh featuring Block Papillon clip Papillon clip officiel clip official official video,10
_5wx-rP0f6c,CE CLASSICO VA BRISER UNE AMITIÉ ! (PSG-OM),Wass Freestyle,17,"freestyle soccer|""freestyle football""|""football""|""freestyle""|""foot freestyle""|""Wass Freestyle""|""junior tv""|""parodie bro""|""lawra meschi""|""psg om""|""classico""|""neymar""",567378,25676,759,CLIQUE ICI POUR ACHETER TA SPEEN BALL: https://speenstyle.com\nLA CHAINE DE SPEEN : http://bit.ly/2hU3F3Q\nAbonne toi à ma chaîne: http://bit.ly/2h4qboZ\n\nFACEBOOK : http://bit.ly/1mJwJ5I \nSNAPCHAT: WASSFREESTYLE\nINSTAGRAM: http://bit.ly/2i3oWbj\nTWITTER: http://bit.ly/1po0Z9B\n\nMerci à :\n\nLawra Meschi : https://www.youtube.com/channel/UCAZi...\n\nEddie Cudi : https://www.youtube.com/channel/UCyi7...\n\nParodies Bros : https://www.youtube.com/channel/UCMqz...\n\nJunior Tv : https://www.youtube.com/channel/UCd5raORb5Zt4dDgENJkUu-g\n\nContact: wassfreestyle@hotmail.fr,2018-02-28,2018-02-27,CE CLASSICO VA BRISER UNE AMITI PSG OM CLIQUE ICI POUR ACHETER TA SPEEN BALL CHAINE DE SPEEN toi ma cha ne nSNAPCHAT WASSFREESTYLE nINSTAGRAM nLawra Meschi Cudi Bros Tv wassfreestyle fr freestyle soccer freestyle football football freestyle foot freestyle Wass Freestyle junior tv parodie bro lawra meschi psg om classico neymar,10
AM2bY9PgniU,Roméo Elvis x Le Motel - Respirer,Roméo Elvis,10,[none],545172,27225,253,Morale2Luxe disponible ici : https://romeoelvis.lnk.to/Morale2Luxe\n\nAuteur : Roméo Elvis  \nCompositeur : Le Motel \nRec/Arrangements/mix/mastering : L’Œil Ecoute Laboratoire  \nRéalisation : Sidney Van Wichelen  \nProduction : Vansi Production  \nDirecteur Photo : Maxime Desmet  \nProducteur Exécutif : Frederic Zaman  \n\nManagement & Booking : www.backinthedayz.be  \n \nRomeo Elvis  \nFacebook : https://www.facebook.com/elvisromeobxl \nInstagram : elvis.romeo \nSnapchat : Johnnystrass \n \nLe Motel \nFacebook : https://www.facebook.com/lemotelofficial \nInstagram : le.motel,2018-03-24,2018-03-23,Rome Elvis Le Motel Respirer Morale Luxe disponible ici Rom Elvis nCompositeur Le Motel nRec Arrangements mix mastering il Ecoute Laboratoire nR alisation Sidney Van Wichelen nProduction Vansi Production nDirecteur Photo Maxime Desmet nProducteur Ex cutif Frederic Zaman nManagement Booking www backinthedayz be n nRomeo Elvis nFacebook nInstagram elvis romeo nSnapchat Johnnystrass n nLe Motel nFacebook nInstagram le motel none,10
T3hXC5yNZOc,Iggy Azalea - Savior ft. Quavo,iggyazaleamusicVEVO,10,"Iggy|""Azalea""|""Savior""|""Island""|""Records""|""Hip""|""Hop""",7848151,322528,32889,"Music video by Iggy Azalea performing Savior. © 2018 Island Records, a division of UMG Recordings, Inc.\n\nhttp://vevo.ly/20QwmL",2018-03-01,2018-03-01,Iggy Azalea Savior ft Quavo Music video by Iggy Azalea performing Savior Island Records division of UMG Recordings Inc n Iggy Azalea Savior Island Records Hip Hop,10
gZrC2iGh3rY,Germany vs Brazil 0-1 All Goals & Highlights Extended 2018 HD,Legendary Football,17,"Germany|""Brazil""",5913107,14024,3176,#Germany  #Brazil,2018-03-28,2018-03-27,Germany vs Brazil All Goals Highlights Extended HD Germany Brazil Germany Brazil,10
9zDZJyzulVg,Nathalie Baye : La révélation choc d'un proche de l'actrice sur Laeticia Hallyday,koi de neuf? Buzz,24,"Nathalie Baye|""Laeticia Hallyday""|""actrice""",303701,427,199,Johnny Hally­day : le jour où Laeti­cia a empê­ché Natha­lie Baye de lui rendre visite à l’hô­pi­ta.l.\nCLIQUEZ ICI POUR INSCRIRE: https://goo.gl/qmbYuA,2018-02-16,2018-02-15,Nathalie Baye La v lation choc un proche de actrice sur Laeticia Hallyday Johnny Hally day le jour Laeti cia emp ch Natha lie Baye de lui rendre visite l pi ta nCLIQUEZ ICI POUR INSCRIRE Nathalie Baye Laeticia Hallyday actrice,10
WfPu9Jrcpuk,"David Guetta, Martin Garrix & Brooks - Like I Do (Lyric Video)",David Guetta,10,"David|""David Guetta""|""Martin""|""Martin Garrix""|""EDM""|""Like I Do""|""So Far Away""|""Electro""|""Dance""|""Ibiza""|""Music""|""Brooks""|""House""|""Techno""|""Beatport""|""DJ Mag""|""Ultra""|""UMF""|""EDC""",6726936,240887,5107,"BUY / LISTEN : https://guetta.co/likeido\n\nDirected by Damian Karsznia\n\nFollow David Guetta:\nhttp://www.davidguetta.com\nhttp://facebook.com/DavidGuetta\nhttp://www.twitter.com/DavidGuetta\nhttp://www.instagram.com/davidguetta\nFollow Martin Garrix:\nhttp://facebook.com/MartinGarrix\nhttp://twitter.com/MartinGarrix\nhttp://instagram.com/MartinGarrix\nhttp://youtube.com/MartinGarrix\nFollow Brooks:\nhttp://facebook.com/MusicByBrooks\nhttp://twitter.com/MusicByBrooks\nhttp://instagram.com/MusicByBrooks\n\nDavid Guetta, Martin Garrix and Brooks - Like I Do\n(Sean Douglas, David Guetta, Martijn Garritsen, Giorgio Tuinfort, Thijs Westbroek, Talay Riley, Nick Seeley, Robert Bergin)\nProduced by David Guetta, Martin Garrix, Giorgio Tuinfort and Brooks\nAll Instruments and Programming by David Guetta, Martin Garrix, Giorgio Tuinfort and Brooks\nKeyboards by Nick Seeley\nTalkbox by The Pianoman\nBackground vocals by Talay Riley\nMixed and mastered by Brooks at Muziekfabriek Studios, The Netherlands\nPublishers: Sony/ATV Ballad/Eastman Pond Publishing (BMI); JackBack Publishing Ltd (SACEM) Administred by Bernstein Shapiro (ASCAP); UMPG; NEW CLASSIC (BUMA); 2D Music Publishing (BMG Talpa Music); UMPG; Artists 101 Publishing Group (BMI) Administred by Warner Chappell; COPYRIGHT CONTROL\n(P) & (C) 2018 What A Music Ltd, Under Exclusive Licence to Parlophone/Warner Music France, a Warner Music Group Company",2018-02-23,2018-02-22,David Guetta Martin Garrix Brooks Like Do Lyric Video BUY LISTEN by Damian Karsznia nFollow David Guetta Martin Garrix Brooks Guetta Martin Garrix and Brooks Like Do Sean Douglas David Guetta Martijn Garritsen Giorgio Tuinfort Thijs Westbroek Talay Riley Nick Seeley Robert Bergin nProduced by David Guetta Martin Garrix Giorgio Tuinfort and Brooks nAll Instruments and Programming by David Guetta Martin Garrix Giorgio Tuinfort and Brooks nKeyboards by Nick Seeley nTalkbox by The Pianoman nBackground vocals by Talay Riley nMixed and mastered by Brooks at Muziekfabriek Studios The Netherlands nPublishers Sony ATV Ballad Eastman Pond Publishing BMI JackBack Publishing Ltd SACEM Administred by Bernstein Shapiro ASCAP UMPG NEW CLASSIC BUMA Music Publishing BMG Talpa Music UMPG Artists Publishing Group BMI Administred by Warner Chappell COPYRIGHT CONTROL P What Music Ltd Under Exclusive Licence to Parlophone Warner Music France Warner Music Group Company David David Guetta Martin Martin Garrix EDM Like Do So Far Away Electro Dance Ibiza Music Brooks House Techno Beatport DJ Mag Ultra UMF EDC,10
D5QAjkpYnqg,👌JE REAGIS A MASTERCLASH DE BRAWKSO,Doigby,20,"DOIGBY|""BRAWKSO""|""FORTNITE""|""MASTERCLASH""|""GOTAGA""",830125,22079,2018,Je réagis à la vidéo de BRAWKSO MASTERCLASH en live ! \n\n→ Télécharge l'extension pour les lives : Chrome : http://bit.ly/1KmRoMa et Firefox : http://mzl.la/1fHYxtC\n\n→ Mon Facebook: http://www.facebook.com/Doigby\n→ Mon Twitter: http://www.twitter.com/Doigby\n→ Mon Site : http://doigby.com/\n→ Valor Collection : http://www.valorcollection.com/,2018-04-03,2018-04-02,JE REAGIS MASTERCLASH DE BRAWKSO Je agis la vid de BRAWKSO MASTERCLASH en live n l charge extension pour les lives Chrome et Firefox Mon Facebook Mon Twitter Mon Site Valor Collection DOIGBY BRAWKSO FORTNITE MASTERCLASH GOTAGA,10
817P8W8-mGE,Ed Sheeran - Perfect Duet (with Beyoncé) [Official Audio],Ed Sheeran,10,"edsheeran|""ed sheeran""|""acoustic""|""live""|""cover""|""official""|""remix""|""official video""|""lyrics""|""session""|""beyonce""|""beyonce live""",55144494,1360654,33292,Listen to this version: https://ad.gt/duetyt\n÷. Out Now: https://atlanti.cr/yt-album\nSubscribe to Ed's channel: http://bit.ly/SubscribeToEdSheeran\n\nFollow Ed on...\nFacebook: http://www.facebook.com/EdSheeranMusic\nTwitter: http://twitter.com/edsheeran\nInstagram: http://instagram.com/teddysphotos\nOfficial Website: http://edsheeran.com,2017-12-02,2017-12-01,Ed Sheeran Perfect Duet with Beyonc Official Audio Listen to this version Out Now to Ed channel Ed on nFacebook Website edsheeran ed sheeran acoustic live cover official remix official video lyrics session beyonce beyonce live,10
3z_E2hc8_Hw,Landy - SKALAPE (clip officiel),Landy Officiel,10,[none],377031,7915,184,Landy vous présente son nouveau titre : SKALAPE\nRéalisation vidéo : HUSTLER GAME\n\nFacebook : https://www.facebook.com/LandyOfficiel\nInstagram : https://www.instagram.com/landyofficiel/\nSnapchat : landyasa93\n-\nSpotify : https://open.spotify.com/artist/2EFpb61Lpi0l5ldOiqbZkK.\nDeezer : http://www.deezer.com/fr/artist/261821\nApple Music : https://itunes.apple.com/fr/artist/landy/1309337700,2018-01-06,2018-01-05,Landy SKALAPE clip officiel Landy vous pr sente son nouveau titre SKALAPE nR alisation vid HUSTLER GAME nFacebook landyasa n nSpotify Music none,10
EAGhzuitLXU,Ed Sheeran - Supermarket Flowers [Live from the BRITs 2018],Ed Sheeran,10,"edsheeran|""ed sheeran""|""acoustic""|""live""|""cover""|""official""|""remix""|""official video""|""lyrics""|""session""|""supermarket""|""flowers""|""the""|""brit's""|""brits""|""brit""|""awards""|""british""|""male""|""artist""|""2018""",8357041,300186,6009,÷. Out Now: https://atlanti.cr/yt-album\nSubscribe to Ed's channel: http://bit.ly/SubscribeToEdSheeran\n\nFollow Ed on...\nFacebook: http://www.facebook.com/EdSheeranMusic\nTwitter: http://twitter.com/edsheeran\nInstagram: http://instagram.com/teddysphotos\nOfficial Website: http://edsheeran.com,2018-02-23,2018-02-22,Ed Sheeran Supermarket Flowers Live from the BRITs Out Now to Ed channel Ed on nFacebook Website edsheeran ed sheeran acoustic live cover official remix official video lyrics session supermarket flowers the brit brits brit awards british male artist,10
EjZpdoFTa68,Take A Mic - Strict Minimum 1,Take A Mic,10,[none],1092305,55512,655,Take A Mic - Strict Minimum 1\n\nProd by Shabz\n\nEP BOÎTE NOIRE : http://smarturl.it/TAMBoiteNoire\nEP BIPOLAIRE : http://smarturl.it/TaMBipolaire\n\nRéalisation du clip : Paul Maillot\n\nSite internet : http://takeamic.fr\nFacebook : https://www.facebook.com/TakeAMicOfficiel/\nInstagram : https://www.instagram.com/takeamicofficiel/\nTwitter : https://twitter.com/TakeAMic,2018-01-24,2018-01-23,Take Mic Strict Minimum Take Mic Strict Minimum n nProd by Shabz nEP BO TE NOIRE BIPOLAIRE alisation du clip Paul Maillot nSite internet none,10
