video_id,title,channel_title,category_id,tags,views,likes,dislikes,description,trending_date,publish_time,text,date_diff
-sq5aXx8m6U,"Roméo Elvis, Le Motel - Ma tête",RomeoElvisVEVO,10,"Roméo|""Elvis""|""Le""|""Motel""|""Ma""|""tête""|""Barclay""|""Hip""|""Hop""|""Roméo Elvis""|""Ma tête""|""Ma Tête""|""Bébé aime la drogue""|""Le Motel""|""Morale 2""|""Morale 2 Luxe""|""Drôle de question""|""J'ai vu""|""Nappeux""|""Lenita""|""Méchant""|""Rap""|""Hip hop""|""Belgique""|""Konbini""|""Les Inrockuptibles""|""Booska-p""|""La Straussphère""|""Straussphère""|""Cabarello""|""JeanJass""|""Bruxelles arrive""|""Grems""|""Cabarello & JeanJass""|""Di-Meh""|""L'Or du Commun""|""Sopico""|""Nelick""|""Romeo Elvis""|""Romeo""|""Angèle""",744445,36062,651,"Auteur : Roméo Elvis \nCompositeur : Le Motel \nRec/Arrangements/mix/mastering : L’oeil écoute laboratoire \nRéalisation : Réalisateur : Julien Kremer aka Krümp\nProduction : Strauss Entertainment SPRL\nManagement & Booking : www.backinthedayz.be \n\nDisponible ici : https://RomeoElvis.lnk.to/MaTete\n\nRomeo Elvis \nFacebook : https://www.facebook.com/elvisromeobxl \nInstagram : elvis.romeo \nSnapchat : Johnnystrass \n\nLe Motel \nFacebook : https://www.facebook.com/lemotelofficial \nInstagram : le.motel \n\nLa Straussphère \nFacebook : https://www.facebook.com/Straussphere \nInstagram : straussphere \n\nMusic video by Roméo Elvis, Le Motel performing Ma tête. (C) 2018 Daring Music\n\nhttp://vevo.ly/d6MAmC",2018-01-30,2018-01-29,Rom Elvis Le Motel Ma te Auteur Rom Elvis nCompositeur Le Motel nRec Arrangements mix mastering L oeil coute laboratoire nR alisation R alisateur Julien Kremer aka Kr mp nProduction Strauss Entertainment SPRL nManagement Booking www backinthedayz be nDisponible ici Elvis nFacebook nInstagram elvis romeo nSnapchat Johnnystrass nLe Motel nFacebook nInstagram le motel nLa Straussph re nFacebook nInstagram straussphere nMusic video by Rom Elvis Le Motel performing Ma te C Daring Music n Rom Elvis Le Motel Ma t te Barclay Hip Hop Rom Elvis Ma te Ma te B aime la drogue Le Motel Morale Morale Luxe Dr le de question J ai vu Nappeux Lenita M chant Rap Hip hop Belgique Konbini Les Inrockuptibles Booska La Straussph re Straussph re Cabarello JeanJass Bruxelles arrive Grems Cabarello JeanJass Di Meh L Or du Commun Sopico Nelick Romeo Elvis Romeo Ang le,10
4ibkoOy-XRY,Les moments forts de l'hommage populaire rendu à Johnny Hallyday,Bruno Ricard,22,"Johnny Hallyday|""hommage""|""Paris""|""France""",199217,323,89,Les moments forts de l'hommage populaire rendu à Johnny Hallyday,2017-12-10,2017-12-09,Les moments forts de hommage populaire rendu Johnny Hallyday Les moments forts de hommage populaire rendu Johnny Hallyday Johnny Hallyday hommage Paris France,10
wHqK7kgMU14,Django - Fauve,Django DKZ,22,[none],1240093,66535,2275,Prod. Django\nRéal : Dante Palma x Django\n1er assistant : Antoine Frugès\nChef op : Maxime Pau\n1er AC : Damien Rubinsztajn \n2nd AC : Romane Jammes\nChef électricien : Nils Gambier\nÉlectricien : Nathan Jean-François\nRégie : Guillaume Labat \nMontage : Django\nÉtalonnage : Romain Battini\n\nFacebook : https://www.facebook.com/DjangoDkZ/\nInstagram : https://www.instagram.com/_____django_____/\nTwitter : https://twitter.com/Django_DKZ,2018-01-23,2018-01-22,Django Fauve Prod Django nR al Dante Palma Django er assistant Antoine Frug nChef op Maxime Pau er AC Damien Rubinsztajn nd AC Romane Jammes nChef lectricien Nils Gambier lectricien Nathan Jean Fran ois nR gie Guillaume Labat nMontage Django talonnage Romain Battini nFacebook none,10
Ph54wQG8ynk,Camila Cabello - Never Be the Same,CamilaCabelloVEVO,10,"camila cabello|""camila""|""camila full album""|""havana""|""never be the same""|""all these years""|""she loves control""|""inside out""|""consequences""|""somethings gotta give""|""in the dark""|""into it""|""crying in the club""|""i have questions""|""fifth harmony""|""camilizers""|""harmonizers""|""Camila Cabello""|""Never Be the Same""|""Pop""|""Syco Music/Epic""",21537871,956140,35387,"Camila album available at: \nSpotify http://smarturl.it/Camila_Sptfy\nApple Music http://smarturl.it/Camila_AM\niTunes http://smarturl.it/Camila_iTunes\nGoogle Play http://smarturl.it/Camila_GP\n\nDirected by Grant Singer\n \nPRODUCER – Saul Germaine\nEXECUTIVE PRODUCER – Nina Soriano\nFor Anonymous Content\n\nDIRECTOR OF PHOTOGRAPHY – André Chemetoff\nPRODUCTION DESIGNER – Joseph Bennett \nEDITOR – Nick Rondeau for Arcade Edit\nUK PRODUCTION COMPANY – Somesuch\nUK PRODUCER –  Jacob Swanhyam\n\nFind Camila Here: \nTwitter: @camila_cabello\nIG: @camila_cabello \nFacebook: @97camilacabello \nWebsite: www.camilacabello.com \n\n#Camila\n\n(C) 2018 Simco Ltd. under exclusive license to Epic Records, a division of Sony Music Entertainment",2018-03-09,2018-03-08,Camila Cabello Never Be the Same Camila album available at nSpotify Music Play by Grant Singer nPRODUCER Saul Germaine nEXECUTIVE PRODUCER Nina Soriano nFor Anonymous Content nDIRECTOR OF PHOTOGRAPHY Andr Chemetoff nPRODUCTION DESIGNER Joseph Bennett nEDITOR Nick Rondeau for Arcade Edit nUK PRODUCTION COMPANY Somesuch nUK PRODUCER Jacob Swanhyam nFind Camila Here nTwitter nIG nFacebook nWebsite www camilacabello com n Camila n Simco Ltd under exclusive license to Epic Records division of Sony Music Entertainment camila cabello camila camila full album havana never be the same all these years she loves control inside out consequences somethings gotta give in the dark into it crying in the club i have questions fifth harmony camilizers harmonizers Camila Cabello Never Be the Same Pop Syco Music Epic,10
P16Lkw6ia6M,VOUS PIÉGEZ VOS COPINES PAR SMS !,Realken7,24,"copine|""sms drole""|""sms""|""realken7""|""r7""",612537,58197,2597,Vous piégez vos copines par SMS à cause de moi !\nDésolé les mecs ...\n\n► POUCES BLEUUUS LES AMIIIS ?\n\nJe compte sur vous !\n\n► Instagram : https://www.instagram.com/realken7/\n► Twitter : https://twitter.com/realken7\n► Snapchat : r7aleex\n► Facebook : https://www.facebook.com/ProRealKen7\n\n__\n\nR7,2017-12-27,2017-12-26,VOUS PI GEZ VOS COPINES PAR SMS Vous pi gez vos copines par SMS cause de moi nD sol les mecs n POUCES BLEUUUS LES AMIIIS n nJe compte sur vous n Instagram Twitter Snapchat r aleex Facebook copine sms drole sms realken,10
lQx6YBtQZbw,"WATCH LIVE: SpaceX launches the Falcon Heavy, the rocket that could go to Mars",PBS NewsHour,25,"spacex|""falcon heavy""|""nasa""",153337,20731,1939,"For more, visit https://www.pbs.org/newshour/science/watch-live-spacex-launches-the-falcon-heavy-the-rocket-that-could-go-to-mars\nSubscribe to PBS NewsHour on YouTube: https://www.youtube.com/pbsnewshour\nMore science coverage from PBS NewsHour: https://www.pbs.org/newshour/science\n\nUPDATE: Liftoff window has been delayed to 3:45 p.m. ET. \n\nOn Tuesday afternoon, a rocket the size of a 20-story building, containing 27 engines and a cherry-red Tesla Roadster as its payload, is slated to lift off from NASA’s Kennedy Space Center in Florida. It will be the maiden flight of Space X’s Falcon Heavy, the most powerful rocket to launch in 45 years, since NASA’s Saturn V, which last flew in 1973.",2018-02-07,2018-02-07,WATCH LIVE SpaceX launches the Falcon Heavy the rocket that could go to Mars For more visit to PBS NewsHour on YouTube science coverage from PBS NewsHour Liftoff window has been delayed to p ET n nOn Tuesday afternoon rocket the size of story building containing engines and cherry red Tesla Roadster as its payload is slated to lift off from NASA Kennedy Space Center in Florida It will be the maiden flight of Space s Falcon Heavy the most powerful rocket to launch in years since NASA Saturn which last flew in spacex falcon heavy nasa,10
2KxtwXvP8aU,Berywam - Havana (Camila Cabello Cover) In 5 Styles - Beatbox,Berywam,10,"Berywam|""Havana""|""Camila Cabello""|""Beatbox""|""Young Thug""|""Cover""|""5 styles""|""Remix""|""Acapella""|""In 5 styles""|""The voice""|""MB14""|""Wawad""|""Beatness""|""Rythmind""|""beatboxing""|""Original""|""Funk""|""Grime""|""Rockabilly""|""Afro""|""Trap""|""French""|""Amazing""|""France""|""Beatboxer""|""vocal""|""singer""|""performance""|""français""|""A cappella""|""Reprise""|""Team""|""Groupe""|""Bass""|""Acapela""",555223,41297,260,"EP AVAILABLE : https://berywam.lnk.to/BerywamEP\n  \nOur remix of Havana (Camila Cabello ft. Young Thug Cover) In 5 Styles !\n \nBERYWAM : Beatbox / Acapella group\nMembers : Beatness, Rythmind, WaWad and MB14 from France.\n\nChoppe tes places pour notre concert exclusif à Paris le 15 Février :\nBleu Citron : http://urlz.fr/6dJP\nFnac : http://urlz.fr/6dZL\nDigitick : http://urlz.fr/6dWv\n\nWebShop : http://berywam.bleucitron.net\n\nAdd us on Facebook:\n\nBerywam - https://www.facebook.com/berywam\nBeatness - http://www.facebook.com/BeatnessBeatboxer\nRythmind - https://www.facebook.com/Rythmind-Beatbox-1525463357699151\nWaWad - https://www.facebook.com/wawadBeatbox\nMB14 - https://www.facebook.com/mb14beatbox/\n\nContact: berywam@gmail.com\nBookings: sam@bleucitron.net / jb@bleucitron.net \n\nAnd please SUBSCRIBE to our channel !",2018-01-30,2018-01-29,Berywam Havana Camila Cabello Cover In Styles Beatbox EP AVAILABLE nOur remix of Havana Camila Cabello ft Young Thug Cover In Styles n nBERYWAM Beatbox Acapella group nMembers Beatness Rythmind WaWad and MB from France nChoppe tes places pour notre concert exclusif Paris le vrier nBleu Citron us on Facebook nBerywam berywam com nBookings sam net jb net nAnd please SUBSCRIBE to our channel Berywam Havana Camila Cabello Beatbox Young Thug Cover styles Remix Acapella In styles The voice MB Wawad Beatness Rythmind beatboxing Original Funk Grime Rockabilly Afro Trap French Amazing France Beatboxer vocal singer performance fran ais A cappella Reprise Team Groupe Bass Acapela,10
wb49-oV0F78,Mission: Impossible - Fallout (2018) - Official Trailer - Paramount Pictures,Paramount Pictures,1,"Official Trailer|""Movie""|""New Movie""|""Film""|""Official""|""Tom Cruise""|""Henry Cavill""|""Simon Pegg""|""Rebecca Ferguson""|""Ving Rhames""|""Sean Harris""|""Angela Bassett""|""Vanessa Kirby""|""Michelle Monaghan""|""Alec Baldwin""|""Release""|""Preview""|""Action""|""Mission Impossible""|""Fallout""|""Mission Impossible Fallout""|""Mission Impossible 6""|""Stunts""|""Christopher McQuarrie""|""J.J. Abrams""|""Bad Robot""|""Skydance""|""Paramount""",31457008,387110,8345,"Watch the official trailer for Mission: Impossible - Fallout starring Tom Cruise. In theatres 7.27.18.\n \n#MissionImpossible #MissionImpossibleMovie\n\nFacebook: https://facebook.com/MissionImpossibleMovie \nInstagram: https://www.instagram.com/MissionImpossible\nTwitter: https://twitter.com/MissionFilm\nHashtag: #MissionImpossible\n \nThe best intentions often come back to haunt you. MISSION: IMPOSSIBLE - FALLOUT finds Ethan Hunt (Tom Cruise) and his IMF team (Alec Baldwin, Simon Pegg, Ving Rhames) along with some familiar allies (Rebecca Ferguson, Michelle Monaghan) in a race against time after a mission gone wrong.  Henry Cavill, Angela Bassett, and Vanessa Kirby also join the dynamic cast with filmmaker Christopher McQuarrie returning to the helm.\n \nParamount Pictures Corporation (PPC), a major global producer and distributor of filmed entertainment, is a unit of Viacom (NASDAQ: VIAB, VIA), home to premier global media brands that create compelling television programs, motion pictures, short-form content, apps, games, consumer products, social media experiences, and other entertainment content for audiences in more than 180 countries.\n \nConnect with Paramount Pictures Online:\n \nOfficial Site: http://www.paramount.com/\nFacebook: https://www.facebook.com/Paramount\nInstagram: http://www.instagram.com/ParamountPics\nTwitter: https://twitter.com/paramountpics\nYouTube: https://www.youtube.com/user/Paramount",2018-02-05,2018-02-05,Mission Impossible Fallout Official Trailer Paramount Pictures Watch the official trailer for Mission Impossible Fallout starring Tom Cruise In theatres MissionImpossible MissionImpossibleMovie nFacebook nInstagram MissionImpossible nThe best intentions often come back to haunt you MISSION IMPOSSIBLE FALLOUT finds Ethan Hunt Tom Cruise and his IMF team Alec Baldwin Simon Pegg Ving Rhames along with some familiar allies Rebecca Ferguson Michelle Monaghan in race against time after mission gone wrong Henry Cavill Angela Bassett and Vanessa Kirby also join the dynamic cast with filmmaker Christopher McQuarrie returning to the helm nParamount Pictures Corporation PPC a major global producer and distributor of filmed entertainment is unit of Viacom NASDAQ VIAB VIA home to premier global media brands that create compelling television programs motion pictures short form content apps games consumer products social media experiences and other entertainment content for audiences in more than countries nConnect with Paramount Pictures Online nOfficial Site Official Trailer Movie New Movie Film Official Tom Cruise Henry Cavill Simon Pegg Rebecca Ferguson Ving Rhames Sean Harris Angela Bassett Vanessa Kirby Michelle Monaghan Alec Baldwin Release Preview Action Mission Impossible Fallout Mission Impossible Fallout Mission Impossible Stunts Christopher McQuarrie J Abrams Bad Robot Skydance Paramount,10
jvNefGT0qQY,Tibo InShape - Bonne Résolution feat. Ma Famille (Clip Officiel),Tibo InShape,17,"tibo inshape|""tibo inshape clip""|""tibo inshape bonne résolution""|""tibo inshape famille""|""tibo inshape clip officiel""|""bonne résolution tibo inshape""",1804998,166383,10540,Tibo Inshape - Bonne résolution (clip officiel)\nClique ici pour t'abonner ► http://bit.ly/1qAbjhL & rejoins la TeamShape !\nMes t-shirts ► http://bit.ly/1wXqeD7 \nMes programmes ►http://bit.ly/2iWtdz9\nMa salle de sport ►http://bit.ly/2jaOdSO\n\nRéduction MyProtein ► https://goo.gl/28Zr8A code TIBO\n\nHARCÈLE-MOI sur : \nTWITTER : http://bit.ly/1o88uUV\nINSTAGRAM : http://bit.ly/1Q4RInr (tiboinshape)\nSNAPCHAT : tiboinshape\nFACEBOOK : http://on.fb.me/1EcbKme\nPERISCOPE : tibo_inshape\n\nCadreur monter : \nFACEBOOK : http://on.fb.me/1DOtxCC\nINSTAGRAM : @liltonemorris\nYOUTUBE : http://bit.ly/1w7NjR\n\nInstrumental : \nhttps://www.facebook.com/djko.ifritrecord\n\nEcriture : \nINSTAGRAM : @liltonemorris\n\nMerci à : \n@antoine_delp\n@jujufitcats\n@dlprtcamille\n@eloisedelaparty\n\nMon adresse postale : \nTibo Inshape\nCS 52072\n81012 ALBI CEDEX\n\nMon e-mail (business uniquement) ► tiboinshapevideo@gmail.com\n\nSi vous lisez cette phrase écrivez « DAAMN » en commentaire !,2018-01-03,2018-01-02,Tibo InShape Bonne solution feat Ma Famille Clip Officiel Tibo Inshape Bonne solution clip officiel nClique ici pour abonner rejoins la TeamShape nMes shirts nMes programmes salle de sport duction MyProtein code TIBO nHARC LE MOI sur nTWITTER tiboinshape nSNAPCHAT tiboinshape nFACEBOOK tibo inshape nCadreur monter nFACEBOOK nYOUTUBE nINSTAGRAM nMerci n nMon adresse postale nTibo Inshape nCS ALBI CEDEX nMon mail business uniquement tiboinshapevideo com nSi vous lisez cette phrase crivez DAAMN en commentaire tibo inshape tibo inshape clip tibo inshape bonne solution tibo inshape famille tibo inshape clip officiel bonne solution tibo inshape,10
CgilZtvv2Mk,OrelSan - Défaite de famille [MAKING OF OFFICIEL],orelsan,10,"orelsan|""la fête est finie""|""san""|""basique""|""simple""|""making off""|""défaite de famille""|""casseurs flowters""|""bonne meuf""|""tout va bien""",1415881,67612,773,"La fête est finie : https://orelsan.lnk.to/LaFeteEstFinie \nLa tournée : https://orelsan.lnk.to/tour \n\nMaking Of: Timothée Hilst\nClip réalisé par OrelSan\nChef op: Christophe Offenstein \nVFX: Bechir Jiwee\nSfx: Olivier Afonso, Atelier 69\nSon: Skread\nMontage: Clément Cotentin\nMaquillage: Laetitia Hillion, Celine Llerena, Juliette\nCoiffure: Mélanie Gerbeaux\nCostume: Charline Grafeuille \nDeco: Fred Doublet et Fred Grandclere\n\nInstagram : https://www.instagram.com/orelsan \nFacebook : https://www.facebook.com/orelsan \nTwitter : https://twitter.com/Orel_san",2018-03-23,2018-03-22,OrelSan D faite de famille MAKING OF OFFICIEL La te est finie nLa tourn nMaking Of Timoth Hilst nClip alis par OrelSan nChef op Christophe Offenstein nVFX Bechir Jiwee nSfx Olivier Afonso Atelier nSon Skread nMontage Cl ment Cotentin nMaquillage Laetitia Hillion Celine Llerena Juliette nCoiffure lanie Gerbeaux nCostume Charline Grafeuille nDeco Fred Doublet et Fred Grandclere nInstagram nFacebook nTwitter orelsan la te est finie san basique simple making off d faite de famille casseurs flowters bonne meuf tout va bien,10
tGRzz0oqgUE,Janelle Monáe – Make Me Feel [Official Music Video],Janelle Monáe,10,"Janelle Monae|""Wonderland""|""Janelle""|""Electric lady""|""Dirty Computer""|""Janelle Monáe""|""monae""|""make me feel""|""emotion picture""",7109851,173739,11955,“Make Me Feel” and “Django Jane” available now: https://janellemonae.lnk.to/dirtycomputer\n\nWatch “Django Jane”: https://youtu.be/mTjQq5rMlEY\n\n“Dirty Computer” - an emotion picture by Janelle Monáe arrives on 4.27.18\n \n*EMOTION PICTURE (definition): a narrative film and accompanying musical album\n \nConnect with Janelle:\nhttp://jmonae.com\nhttp://instagram.com/janellemonae\nhttp://twitter.com/janellemonae\nhttp://facebook.com/janellemonae\n\nJanelle Monáe – Make Me Feel [Official Music Video]\nDirector: Alan Ferguson,2018-02-23,2018-02-22,Janelle Mon Make Me Feel Official Music Video Make Me Feel and Django Jane available now Django Jane Dirty Computer an emotion picture by Janelle Mon arrives on n EMOTION PICTURE definition a narrative film and accompanying musical album nConnect with Janelle Mon Make Me Feel Official Music Video nDirector Alan Ferguson Janelle Monae Wonderland Janelle Electric lady Dirty Computer Janelle Mon monae make me feel emotion picture,10
lXnCSZcjR10,Elams - Glock (Clip Officiel),Elams Officiel,10,"Elams|""Glock""|""rap""|""marseille""|""elamstone""|""clip""|""fr""",1033415,23800,928,Nouveau clip de Elams - Glock\nAbonne toi à la chaîne :  http://bit.ly/2AqWPsd\n\nRetrouvez Elams sur :\n\nFacebook : https://m.facebook.com/pages/Elams-officiel/148467718548357?fref=ts\nTwitter : https://twitter.com/ElamStone\nInstagram : https://instagram.com/elamstone\nProd : Newstreetmelody \nLien : https://www.youtube.com/user/NewStreetMelody,2017-12-16,2017-12-15,Elams Glock Clip Officiel Nouveau clip de Elams Glock nAbonne toi la cha ne Elams sur n nFacebook Newstreetmelody nLien Elams Glock rap marseille elamstone clip fr,10
N8kTqxxtnAI,PRIME– Bail 2 Sneakers,PTIT DELIRE,10,"Prime|""primetimefut""|""interview prime""|""prime bataclan""|""prime concert""|""prime gang""|""baloo""|""bail 2 sneakers""|""niska""|""caballero jean jass""|""puma""|""citadium""|""sneakers""|""primenation""|""maskey""|""maskeylevrai""|""ptit delire""|""ptit delire show""|""benzema""|""kaaris""|""alonzo""|""mhd puma""|""baloo show""|""deen burbigo""",364629,19083,270,"Découvrez un épisode spécial de BALOO en compagnie de PRIME !!! Turn up en plein bataclan pour la release de la nouvelle Puma Tsugi Jun 🔥\nAbonne-toi, fais pas le timide 👉 http://po.st/ptitdeliretv\n\nBaloo : https://www.facebook.com/FrenchBaloo   \nPrime : https://www.youtube.com/user/PrimeTimeFUT \nPuma Tsugi Jun dispo : http://po.st/tsugijun \nRéal Dam Koman : https://www.instagram.com/dam_koman/ \n\nFollow-nous\n►Facebook http://www.facebook.com/ptitdeliretv\n►Twitter http://www.twitter.com/ptitdeliretv\n►Instagram http://www.instagram.com/ptitdeliretv\n\n\nRemerciements \nPrimetime Corp, Puma, Citadium et le Bataclan pour leur accueil\nJeremy Masuka pour le shooting photo\nMercutio pour la musique off\n\nRetrouve nos playlists :\nBail 2 Sneakers http://po.st/bail2sneakers\nPtit Délire Show http://po.st/ptitdelireshow\nInterview http://po.st/interview-urbain\n\n© Green Garden 2017",2017-11-20,2017-11-19,PRIME Bail Sneakers couvrez un pisode sp cial de BALOO en compagnie de PRIME Turn up en plein bataclan pour la release de la nouvelle Puma Tsugi Jun nAbonne toi fais pas le timide nPrime nPuma Tsugi Jun dispo nR al Dam Koman n nFollow nous Facebook Twitter Instagram nPrimetime Corp Puma Citadium et le Bataclan pour leur accueil nJeremy Masuka pour le shooting photo nMercutio pour la musique off nRetrouve nos playlists nBail Sneakers D lire Show Green Garden Prime primetimefut interview prime prime bataclan prime concert prime gang baloo bail sneakers niska caballero jean jass puma citadium sneakers primenation maskey maskeylevrai ptit delire ptit delire show benzema kaaris alonzo mhd puma baloo show deen burbigo,10
