video_id,title,channel_title,category_id,tags,views,likes,dislikes,description,trending_date,publish_time,text,date_diff
W6aOCchbQCc,Love Songs Guitar Music 2018 - Pure Romance Songs - True Love Doesn't Mean Being Inseparable,Music Relaxing,10,"Love Songs|""Guitar Love""|""Guitar Songs""|""Guitar Love Songs""|""Love Songs Guitar Music""|""Pure Romance""|""Romance Songs""|""Pure Romance Songs""|""True Love""|""True Love Mean""|""True Love Doesn't Mean Being Inseparable""|""Love""|""Songs""|""Guitar""|""Music""|""Pure""|""Romance""|""True""|""Inseparable""",1565883,1205,700,"Love Songs Guitar Music 2018 - Pure Romance Songs - True Love Doesn't Mean Being Inseparable.\n\n❤❤SUBSCRIBE NOW: https://goo.gl/8Ae3C9  ❤❤\n This is the best Guitar music for relaxing and stress relief, sleep, spa and meditation. The content of the video is the lovely and romantic Guitar music in 2018, best love songs Guitar cover. The lovely and beautiful Guitar music will touch your heart and make you relax and healing. The beautiful and romantic music relaxing will erase all your fatigue or help you study and concentration. The background of the video with many beautiful nature landscape pictures will also help you relieve stress and relax. Enjoy 2 hour of best relaxing music romantic Guitar love songs cover for morning. You can use it for relax, sleep, meditation, healing, spa... etc. Just listen and feel it to relax your mind and yourself.\nDon't forget to Comment and let me know what you think!\nIf you like my playlist please LIKE and SHARE my videos! Subscribe for new uploads every day!\nJoin the Relaxing Music community on social media:\nhttps://www.youtube.com/channel/UCJD2TJ1z3iiKWCi169aA7pA?sub_confirmation=1\n► Facebook: https://www.facebook.com/relaxdailymusicchannel\n► Google+: https://plus.google.com/u/0/115417729902215212997\n✖ IMPORTANT ✖ \nIf there are any copyright infringement send e-mail to us or comment on this video!!!\nThank You for Everything",2018-02-11,2018-02-10,Love Songs Guitar Music Pure Romance Songs True Love Doesn Mean Being Inseparable Love Songs Guitar Music Pure Romance Songs True Love Doesn Mean Being Inseparable n SUBSCRIBE NOW This is the best Guitar music for relaxing and stress relief sleep spa and meditation The content of the video is the lovely and romantic Guitar music in best love songs Guitar cover The lovely and beautiful Guitar music will touch your heart and make you relax and healing The beautiful and romantic music relaxing will erase all your fatigue or help you study and concentration The background of the video with many beautiful nature landscape pictures will also help you relieve stress and relax Enjoy hour of best relaxing music romantic Guitar love songs cover for morning You can use it for relax sleep meditation healing spa etc Just listen and feel it to relax your mind and yourself nDon forget to Comment and let me know what you think nIf you like my playlist please LIKE and SHARE my videos Subscribe for new uploads every day nJoin the Relaxing Music community on social media Facebook Google IMPORTANT nIf there are any copyright infringement send mail to us or comment on this video nThank You for Everything Love Songs Guitar Love Guitar Songs Guitar Love Songs Love Songs Guitar Music Pure Romance Romance Songs Pure Romance Songs True Love True Love Mean True Love Doesn Mean Being Inseparable Love Songs Guitar Music Pure Romance True Inseparable,10
S9KxqRUcnCU,Boomerang Trick Shots | Dude Perfect,Dude Perfect,17,"dude perfect|""dude perfect stereotypes""|""dude perfect water bottle flip""|""bottle flip""|""water bottle flip""|""dude perfect bottle flip""|""dude perfect basketball""|""dp""|""dude perfect world record""|""edition""|""nerf""|""trick shots""|""trick shot""|""family""|""ping pong""|""bowling""|""clean""|""family friendly""|""bubble wrap""|""soccer""|""football""|""spinner""|""spinners""|""fidget spinners""|""dude""|""boomerang""|""throw""|""thrower""|""logan""|""broadbent""",36872821,1270444,27359,"Time to take boomerangs to the next level!\n► Click HERE to subscribe to Dude Perfect! http://bit.ly/SubDudePerfect\n\n► Click HERE to watch our most recent videos! http://bit.ly/NewestDudePerfectVideos\nhttp://bit.ly/NewestDPVideos\n\n►Click HERE to follow Logan on Instagram!\nFollow @logan.broadbent: \nhttp://dudeperfect.com/boomerang\n\n► SHOP our NEW Merchandise! - http://bit.ly/DPStore\n►Click HERE to join the exclusive Dude Perfect T-Shirt Club! http://bit.ly/DPTShirtClub\n\nMusic: Army by Zayde Wolf\n►Click HERE to download : http://smarturl.it/ZWGoldenAge\n\nPlay our NEW iPhone game!\n► PLAY Endless Ducker on iPhone -- http://smarturl.it/EndlessDucker\n► PLAY Endless Ducker on Android -- http://smarturl.it/EndlessDucker\n\n► VISIT our NEW STORE - http://bit.ly/DPStore\n► JOIN our NEWSLETTER - http://bit.ly/DPNewsletterEndCard\n► WATCH our STEREOTYPES - http://bit.ly/StereotypesPlaylist\n\nIn between videos we hang out with you guys on Instagram, Snapchat, Twitter, and Facebook so pick your favorite one and hang with us there too!\n\nhttp://Instagram.com/DudePerfect\nhttp://bit.ly/DudePerfectSnapchat\nhttp://Twitter.com/DudePerfect\nhttp://Facebook.com/DudePerfect\n\nDo you have a GO BIG mindset? \nSee for yourself in our book Go Big. \n►http://amzn.to/OYdZ2s\n\nA special thanks to those of you who play our iPhone Games and read our book. You guys are amazing and all the great things you tell us about the game and the book make those projects so worthwhile for us! \n\nDude Perfect GAME - http://smarturl.it/DPGameiPhone\nDude Perfect BOOK - Go Big - http://amzn.to/OYdZ2s\n\nClick here if you want to learn more about Dude Perfect:\nhttp://www.dudeperfect.com/blog-2/\n\nBonus points if you're still reading this! \nComment \n\nAs always...Go Big and God Bless!\n- Your friends at Dude Perfect\n\nBusiness or Media, please contact us at: \nDude@DudePerfect.com\n\n------------\n\n5 Best Friends and a Panda.\nIf you like Sports + Comedy, come join the Dude Perfect team!\n\nBest known for trick shots, stereotypes, battles, bottle flips, ping pong shots and all around competitive fun, Dude Perfect prides ourselves in making the absolute best family-friendly entertainment possible! Welcome to the crew! \n\nPound it. Noggin. \n- Dude Perfect",2018-03-27,2018-03-26,Boomerang Trick Shots Dude Perfect Time to take boomerangs to the next level Click HERE to subscribe to Dude Perfect Click HERE to watch our most recent videos Click HERE to follow Logan on Instagram nFollow broadbent n SHOP our NEW Merchandise Click HERE to join the exclusive Dude Perfect Shirt Club Army by Zayde Wolf Click HERE to download our NEW iPhone game PLAY Endless Ducker on iPhone PLAY Endless Ducker on Android VISIT our NEW STORE JOIN our NEWSLETTER WATCH our STEREOTYPES between videos we hang out with you guys on Instagram Snapchat Twitter and Facebook so pick your favorite one and hang with us there too n you have GO BIG mindset nSee for yourself in our book Go Big n special thanks to those of you who play our iPhone Games and read our book You guys are amazing and all the great things you tell us about the game and the book make those projects so worthwhile for us n nDude Perfect GAME Perfect BOOK Go Big here if you want to learn more about Dude Perfect points if you re still reading this nComment nAs always Go Big and God Bless Your friends at Dude Perfect nBusiness or Media please contact us at nDude com n n Best Friends and Panda nIf you like Sports Comedy come join the Dude Perfect team nBest known for trick shots stereotypes battles bottle flips ping pong shots and all around competitive fun Dude Perfect prides ourselves in making the absolute best family friendly entertainment possible Welcome to the crew n nPound it Noggin n Dude Perfect dude perfect dude perfect stereotypes dude perfect water bottle flip bottle flip water bottle flip dude perfect bottle flip dude perfect basketball dp dude perfect world record edition nerf trick shots trick shot family ping pong bowling clean family friendly bubble wrap soccer football spinner spinners fidget spinners dude boomerang throw thrower logan broadbent,10
gok-gkH4bwA,"Epic Chili Cheese Fries!! (10,120 Calories)",Matt Stonie,24,"Matt Stonie|""Megatoad""|""Competitive Eating""|""Food Challenge""|""Speed Eating""|""Eating Challenge""|""Chili Cheese Fries""|""Cheese Fries""|""French Fries""|""French Fry Challenge""",7012975,153253,10670,"This video is sponsored by Dollar Shave Club!\nJoin the Club today - http://www.dollarshaveclub.com/MattStonie\nNew members get their 1st month of the Dollar Shave Club Starter Set including the Executive Razor and trial-sized versions of their Shave Butter, Body Cleanser and One Wipe Charlies’ Butt Wipes for ONLY $5 (and free shipping). After that razors are just a few bucks a month. \n\nGood Video? Like/Fav & Share!!\n\nI won't lie, Chili Cheese Fries just sounded good... only inspiration for today's video..\n\nENJOY!!!\n\nFollow me on Social!\nFACEBOOK - http://www.facebook.com/megatoad\nTWITTER - https://twitter.com/MattStonie\nINSTAGRAM - http://instagram.com/matt_stonie\nTWITCH - https://www.twitch.tv/mstonie\nMERCH - http://mattstonie.bigcartel.com/\n\nMailing Address:\nP.O. Box 22210\nSan Jose, CA 95151\n\nBusiness\n\nCredits:\nRoyalty Free Music by http://audiomicro.com/royalty-free-music",2018-03-02,2018-03-01,Epic Chili Cheese Fries Calories This video is sponsored by Dollar Shave Club nJoin the Club today members get their st month of the Dollar Shave Club Starter Set including the Executive Razor and trial sized versions of their Shave Butter Body Cleanser and One Wipe Charlies Butt Wipes for ONLY and free shipping After that razors are just few bucks month n nGood Video Like Fav Share n nI won lie Chili Cheese Fries just sounded good only inspiration for today video n nENJOY nFollow me on Social nFACEBOOK Address nP Box nSan Jose CA nBusiness nCredits nRoyalty Free Music by Matt Stonie Megatoad Competitive Eating Food Challenge Speed Eating Eating Challenge Chili Cheese Fries Cheese Fries French Fries French Fry Challenge,10
SM1w9PEQOE8,Demi Lovato - Tell Me You Love Me,DemiLovatoVEVO,10,"Demi Lovato|""Tell Me You Love Me""|""Jesse Williams""|""Demi""|""Lovato""|""Tell""|""Me""|""You""|""Love""|""Island""|""Records""|""Pop""",37534609,1658351,35987,"Demi Lovato Tell Me You Love Me DELUXE: https://IslandRecs.lnk.to/TMYLMdeluxe\n\nDemi Lovato Tell Me You Love Me STANDARD: https://IslandRecs.lnk.to/TMYLM\n\nBest of Demi Lovato: https://goo.gl/SmqS1T\nSubscribe here: https://goo.gl/qRsogB\n\nMusic video by Demi Lovato performing Tell Me You Love Me. (C) 2017 Island Records, a division of UMG Recordings, Inc./Hollywood Records/Safehouse Records LLC\n\nhttp://vevo.ly/jOKrgh",2017-12-02,2017-12-01,Demi Lovato Tell Me You Love Me Demi Lovato Tell Me You Love Me DELUXE Lovato Tell Me You Love Me STANDARD of Demi Lovato here video by Demi Lovato performing Tell Me You Love Me C Island Records division of UMG Recordings Inc Hollywood Records Safehouse Records LLC n Demi Lovato Tell Me You Love Me Jesse Williams Demi Lovato Tell Me You Love Island Records Pop,10
qZHycHI3F1Q,Football vs Soccer Trick Shots | Dude Perfect,Dude Perfect,17,"dude perfect|""dude perfect stereotypes""|""dude perfect water bottle flip""|""bottle flip""|""water bottle flip""|""dude perfect bottle flip""|""dude perfect basketball""|""dp""|""dude perfect world record""|""edition""|""nerf""|""trick shots""|""trick shot""|""family""|""ping pong""|""bowling""|""clean""|""family friendly""|""bubble wrap""|""soccer""|""football""|""spinner""|""spinners""|""fidget spinners""|""dude""|""f2""|""tekkers""|""smu""|""european""|""brittish""|""london""|""manchester""|""united""|""preimere""|""league""|""juggle""|""skills""|""str""|""freestylers""|""freestyle""|""ball""|""tricks""|""real life""",27085045,862168,14742,"Dude Perfect football vs F2 soccer... trick shot style! \n► Special thanks to Whistle Sports! Click HERE to subscribe to Whistle Sports: http://dudeperfect.com/SubWhistle\n► Click HERE to subscribe to Dude Perfect! http://bit.ly/SubDudePerfect\n► Click HERE to subscribe to F2! \nhttp://dudeperfect.com/SubF2\n\n► SHOP our NEW Merchandise! - http://bit.ly/DPStore\n\n► Click HERE to watch our most recent videos! http://bit.ly/NewestDudePerfectVideos\nhttp://bit.ly/NewestDPVideos\n\n►Click HERE to join the exclusive Dude Perfect T-Shirt Club! http://bit.ly/DPTShirtClub\n\nMusic: Zayde Wølf - “Hustler”\n►Click HERE to download: http://dudeperfect.com/ZWHustler\n►http://zaydewolf.com\n►http://youtube.com/zaydewolf\n►http://.instagram.com/zaydewolf\n►http://.facebook.com/zaydewolf\n►http://twitter.com/zaydewolf\n\nPlay our NEW iPhone game!\n► PLAY Endless Ducker on iPhone -- http://smarturl.it/EndlessDucker\n► PLAY Endless Ducker on Android -- http://smarturl.it/EndlessDucker\n\n► VISIT our NEW STORE - http://bit.ly/DPStore\n► JOIN our NEWSLETTER - http://bit.ly/DPNewsletterEndCard\n► WATCH our STEREOTYPES - http://bit.ly/StereotypesPlaylist\n\nIn between videos we hang out with you guys on Instagram, Snapchat, Twitter, and Facebook so pick your favorite one and hang with us there too!\n\nhttp://Instagram.com/DudePerfect\nhttp://bit.ly/DudePerfectSnapchat\nhttp://Twitter.com/DudePerfect\nhttp://Facebook.com/DudePerfect\n\nDo you have a GO BIG mindset? \nSee for yourself in our book Go Big. \n►http://amzn.to/OYdZ2s\n\nA special thanks to those of you who play our iPhone Games and read our book. You guys are amazing and all the great things you tell us about the game and the book make those projects so worthwhile for us! \n\nDude Perfect GAME - http://smarturl.it/DPGameiPhone\nDude Perfect BOOK - Go Big - http://amzn.to/OYdZ2s\n\nClick here if you want to learn more about Dude Perfect:\nhttp://www.dudeperfect.com/blog-2/\n\nBonus points if you're still reading this! \nComment: Jezza's laugh is amazing!\n\nAs always...Go Big and God Bless!\n- Your friends at Dude Perfect\n\nBusiness or Media, please contact us at: \nDude@DudePerfect.com\n\n------------\n\n5 Best Friends and a Panda.\nIf you like Sports + Comedy, come join the Dude Perfect team!\n\nBest known for trick shots, stereotypes, battles, bottle flips, ping pong shots and all around competitive fun, Dude Perfect prides ourselves in making the absolute best family-friendly entertainment possible! Welcome to the crew! \n\nPound it. Noggin. \n- Dude Perfect",2018-02-20,2018-02-19,Football vs Soccer Trick Shots Dude Perfect Dude Perfect football vs soccer trick shot style n Special thanks to Whistle Sports Click HERE to subscribe to Whistle Sports Click HERE to subscribe to Dude Perfect Click HERE to subscribe to n SHOP our NEW Merchandise Click HERE to watch our most recent videos Click HERE to join the exclusive Dude Perfect Shirt Club Zayde lf Hustler Click HERE to download our NEW iPhone game PLAY Endless Ducker on iPhone PLAY Endless Ducker on Android VISIT our NEW STORE JOIN our NEWSLETTER WATCH our STEREOTYPES between videos we hang out with you guys on Instagram Snapchat Twitter and Facebook so pick your favorite one and hang with us there too n you have GO BIG mindset nSee for yourself in our book Go Big n special thanks to those of you who play our iPhone Games and read our book You guys are amazing and all the great things you tell us about the game and the book make those projects so worthwhile for us n nDude Perfect GAME Perfect BOOK Go Big here if you want to learn more about Dude Perfect points if you re still reading this nComment Jezza laugh is amazing nAs always Go Big and God Bless Your friends at Dude Perfect nBusiness or Media please contact us at nDude com n n Best Friends and Panda nIf you like Sports Comedy come join the Dude Perfect team nBest known for trick shots stereotypes battles bottle flips ping pong shots and all around competitive fun Dude Perfect prides ourselves in making the absolute best family friendly entertainment possible Welcome to the crew n nPound it Noggin n Dude Perfect dude perfect dude perfect stereotypes dude perfect water bottle flip bottle flip water bottle flip dude perfect bottle flip dude perfect basketball dp dude perfect world record edition nerf trick shots trick shot family ping pong bowling clean family friendly bubble wrap soccer football spinner spinners fidget spinners dude f tekkers smu european brittish london manchester united preimere league juggle skills str freestylers freestyle ball tricks real life,10
tVH0cErvUw8,"Mariah Carey - Que Je T'aime Live (hommage à Johnny Hallyday) @ AccorHotels Arena, Paris, 2017",Kéké,24,"Mariah Carey|""Que Je t’aime""|""Hommage""|""Johnny""|""Johnny Hallyday""|""Concert""|""Live""|""2017""|""All I Want For Christmas Is You Tour""|""France""|""Paris""|""AccorHotels Arena""|""Bercy""|""Without You""|""Hero""|""kekeLMB""|""HD""|""We Belong Together""|""Oh Santa""",466529,1897,290,"Mariah Carey - Que Je T'aime Live (hommage à Johnny Hallyday) Live @ All I Want For Christmas Is You Tour, AccorHotels Arena, Paris, 09/12/2017. Compte-rendu, photos et vidéos sur http://www.kekelmb.com. Rejoignez-moi dès maintenant sur les réseaux sociaux 😉\n+ Facebook : http://www.facebook.com/kekeLMB  \n+ Twitter : http://twitter.com/kekeLMB \n+ Instagram : http://www.instagram.com/kekelmb",2017-12-11,2017-12-09,Mariah Carey Que Je aime Live hommage Johnny Hallyday AccorHotels Arena Paris Mariah Carey Que Je aime Live hommage Johnny Hallyday Live All Want For Christmas Is You Tour AccorHotels Arena Paris Compte rendu photos et vid os sur Rejoignez moi s maintenant sur les seaux sociaux n Facebook Twitter n Instagram Mariah Carey Que Je aime Hommage Johnny Johnny Hallyday Concert Live All Want For Christmas Is You Tour France Paris AccorHotels Arena Bercy Without You Hero kekeLMB HD We Belong Together Oh Santa,10
18JBkN3FrJs,Faire la Potion de FORTNITE,Superconeri,23,"fortnite|""fortnighte""|""top 1""|""top""|""battle royal""|""battle""|""royal""|""best""|""record""|""Best Moments""|""moments""|""pioche""|""de""|""récupération""|""pioche de récupération""|""free vbucks""|""passe de combat gratuit""|""nouvelle saison""|""nouveau skins""|""skins""|""saison""|""nouveau""|""gratuit""|""free""|""vbucks""",659054,36539,1674,Dans cette vidéo je réalise la potion dans le jeu Fortnite \n\nTwitter : https://twitter.com/Superconeriii\ninsta : https://www.instagram.com/superconeri\n\nLe site RESINPRO : https://resinpro.fr/ \n\nCode promo -10% : RESINPRO2018 \n\nMa résine : https://resinpro.fr/collections/resin...\n\nMusique:\n\n-intro https://www.youtube.com/watch?v=cU8HrO7XuiE\n\n-1 Echoes Of War - Johan Johansson\n- 2 Jojo's Bizarre Adventure- Awaken(Pillar Men Theme)\n-3 Dragon Call - Andreas Ericson\n-4 WAR - Why Can't We Be Friends\n\n-outro https://www.youtube.com/watch?v=IRiG-7c9A3c,2018-03-12,2018-03-11,Faire la Potion de FORTNITE Dans cette vid je alise la potion dans le jeu Fortnite nTwitter site RESINPRO n nCode promo RESINPRO n nMa sine Echoes Of War Johan Johansson Jojo Bizarre Adventure Awaken Pillar Men Theme Dragon Call Andreas Ericson WAR Why Can We Be Friends n outro fortnite fortnighte top top battle royal battle royal best record Best Moments moments pioche de r cup ration pioche de cup ration free vbucks passe de combat gratuit nouvelle saison nouveau skins skins saison nouveau gratuit free vbucks,10
VwAnsAUYnw4,"Jay Rock, Kendrick Lamar, Future, James Blake - King's Dead",JayRockVEVO,10,"Kendrick Lamar|""hip-hop""|""R&B""|""Black Panther""|""TDE""|""Top Dawg Entertainment""|""Jay Rock""|""Future""|""James Blake""|""Jay""|""Rock""|""Kendrick""|""Lamar""|""James""|""Blake""|""King's""|""Dead""|""Top""|""Dawg""|""Ent./Aftermath/Interscope""|""Records""|""Hip""|""Hop""",18532237,529532,22114,"Directed by Dave Free (the little homies) & Jack Begert\nBlack Panther The Album Music From And Inspired By\nAVAILABLE NOW: http://smarturl.it/BlackPantherAlbum\n\nMusic video by Jay Rock, Kendrick Lamar, Future, James Blake performing King's Dead. (C) 2018 Aftermath Records\n\nhttp://vevo.ly/OA5yJn",2018-02-16,2018-02-15,Jay Rock Kendrick Lamar Future James Blake King Dead Directed by Dave Free the little homies Jack Begert nBlack Panther The Album Music From And Inspired By nAVAILABLE NOW video by Jay Rock Kendrick Lamar Future James Blake performing King Dead C Aftermath Records n Kendrick Lamar hip hop R Black Panther TDE Top Dawg Entertainment Jay Rock Future James Blake Jay Rock Kendrick Lamar James Blake King Dead Top Dawg Ent Aftermath Interscope Records Hip Hop,10
TYSc3LUkkT4,Direct Combat Sa thies Vs  Boy NianG,Dakarbuzz,17,[none],186910,1207,166,Direct Combat Sa thies Vs  Boy NianG,2018-03-12,2018-03-11,Direct Combat Sa thies Vs Boy NianG Direct Combat Sa thies Vs Boy NianG none,10
ok_CSE9Xogo,J'AI SOUILLÉ NEW YORK !,Math se fait des films !,23,[none],320431,31569,212,Quand un souillon de lama débarque à New York...\n\n➜ REJOIGNEZ LA SOUILLE :\nTWITTER : https://twitter.com/Msefaitdesfilms\nFACEBOOK : https://www.facebook.com/MathSeFaitDesFilms\nINSTA : https://www.instagram.com/mathsefaitdesfilms/\nSNAP : https://www.snapchat.com/add/msefaitdesfilms\n\nSouillon on board.\n\n\n➜ Copyright :\nCasino Soundtrack - The Animals - The House of the Rising Sun mafia,2017-11-26,2017-11-25,AI SOUILL NEW YORK Quand un souillon de lama barque New York n REJOIGNEZ LA SOUILLE nTWITTER on board n Copyright nCasino Soundtrack The Animals The House of the Rising Sun mafia none,10
CziHrYYSyPc,Netta - TOY - Israel - Official Music Music - Eurovision 2018,Eurovision Song Contest,24,"Eurovision Song Contest|""2018""|""Lisbon""|""Israel""|""Toy""|""Netta""|""Official""|""Music Video""",9421780,228358,36576,"Netta will represent Israel at the 2018 Eurovision Song Contest in Lisbon with the song TOY\n\nIf you want to know more about the Eurovision Song Contest, visit https://eurovision.tv",2018-03-12,2018-03-11,Netta TOY Israel Official Music Music Eurovision Netta will represent Israel at the Eurovision Song Contest in Lisbon with the song TOY nIf you want to know more about the Eurovision Song Contest visit Eurovision Song Contest Lisbon Israel Toy Netta Official Music Video,10
6BugyCWC7j0,[CHOC] Lopes DETRUIT Mbappé !!,NeilTV,24,"Mbappé|""Choc""|""Math""|""Match""|""Blessure""|""PSG""|""OL""|""Lopez""|""Lopes""|""Mbappe""",225404,168,293,nan,2018-01-22,2018-01-21,CHOC Lopes DETRUIT Mbapp nan Mbapp Choc Math Match Blessure PSG OL Lopez Lopes Mbappe,10
B9rXuK53MNA,Rdat Lwalida - Ep 28 - رضاة الوالدة الحلقة,Al Aoula TV,24,"Al|""Aoula""|""TV""|""Maroc""|""HD""|""aloula""|""rtm""|""snrt""|""Rdat Lwalida""|""رضاة""|""redate el walida""|""الحلقة28""|""Ep 28""|""episode 28""|""عبد الاله رشيد""|""راوية""|""سعدية أزكون""|""فاطمة زهرة لحرش""|""أسامة بسطاوي""|""مالك أخميس""|""abdelilah""",1409688,7954,1033,Application SNRTLIVE :\n- Appstore : https://itunes.apple.com/fr/app/snrt-live/id1148869862?mt=8\n- Playstore : https://play.google.com/store/apps/details?id=ma.snrt.live \n\nSite web: www.alaoula.ma - www.snrtlive.ma - www.snrt.ma\n\nYouTube:\nhttp://www.youtube.com/c/AlAoulaTV?sub_confirmation=1\nFacebook:\nhttps://www.facebook.com/AlAoulaTVMaroc/,2018-01-30,2018-01-29,Rdat Lwalida Ep Application SNRTLIVE n Appstore Playstore n nSite web www alaoula ma www snrtlive ma www snrt ma nYouTube Al Aoula TV Maroc HD aloula rtm snrt Rdat Lwalida redate el walida Ep episode abdelilah,10
sVc7s06Kc1c,#SS11 - Les finalistes très émus par la mort de Johnny Hallyday !,Secret Story Officiel,24,"telerealite|""christophe beaugrand""|""quotidienne""|""ss11""|""deces""|""mort""|""johnny hallyday""|""laura - secret story 11""|""charlene - secret story 11""|""barbara - secret story 11""|""nore - secret story 11""",545744,4607,2154,★ Toute l'actu de Secret Story ici : http://bit.ly/ActuSecretStory\n★ Revoir les meilleurs moments : http://bit.ly/2ad6XN0\n★ Abonnez-vous à la chaîne : http://bit.ly/SecretStoryAbonnement\n\nRDV sur MYTF1 : http://www.tf1.fr/tf1/secret-story\nLe Facebook de Secret Story : https://www.facebook.com/Secret.Story\nLe Twitter de Secret Story : https://twitter.com/SecretStory_TF1,2017-12-08,2017-12-07,SS Les finalistes tr mus par la mort de Johnny Hallyday Toute actu de Secret Story ici Revoir les meilleurs moments Abonnez vous la cha ne sur MYTF Facebook de Secret Story Twitter de Secret Story telerealite christophe beaugrand quotidienne ss deces mort johnny hallyday laura secret story charlene secret story barbara secret story nore secret story,10
q5kkoBYJqhY,JE SUIS DE NOUVEAU CÉLIBATAIRE !,PRIME,23,"TOPCOM|""SPEED DATING""|""BEAU BRUN""",908381,57114,2822,POUR TA PLACE DE CONCERT ► http://bit.ly/2DfAHSs\n\nABONNE TOI ! ► http://bit.ly/2yxf69k\n\n►MON INSTAGRAM : http://instagram.com/PRIMETIMEFUT\n\n►SOUNDCLOUD : https://soundcloud.com/primetimefut\n\n►MON TWITTER : https://twitter.com/PRIMETIMEFUT\n\n►SNAP : MANYPRIME\n\n►FACEBOOK : https://www.facebook.com/LePrimeTime\n\n►TWITCH : https://www.twitch.tv/primetimefut\n\n►TUMBLR : https://prime4real4real.tumblr.com/\n\n► POUR DES JEUX PAS CHÈRE : http://www.instant-gaming.com/fr/igr367676/ \n\n►Business contact : FUTTHEWORLDTV2@gmail.com,2018-01-12,2018-01-10,JE SUIS DE NOUVEAU LIBATAIRE POUR TA PLACE DE CONCERT TOI MON INSTAGRAM SOUNDCLOUD MON TWITTER SNAP MANYPRIME n FACEBOOK TWITCH TUMBLR POUR DES JEUX PAS CH RE n Business contact FUTTHEWORLDTV com TOPCOM SPEED DATING BEAU BRUN,10
