video_id,title,channel_title,category_id,tags,views,likes,dislikes,description,trending_date,publish_time,text,date_diff
BjiIY0hXMh8,GAG DANS L'OREILLETTE AVEC HORIA,Golden Moustache,23,"GOLDEN MOUSTACHE|""HUMOUR""|""DROLE""|""RIRE""|""BLAGUE""|""PRANK""|""COMEDIE""|""OMG""|""LE PERAVE""|""PIERRE LAPIN""|""HORIA""",730441,50868,4167,"AIME-NOUS : http://www.facebook.com/goldenmoustache \nNotre Twitter : http://www.twitter.com/goldenmoustache \nNotre YouTube : http://www.youtube.com/goldenmoustachevideo \nNotre Dailymotion : http://www.dailymotion.com/GoldenMoustache \nNotre Instagram : http://www.instagram.com/goldenmoustacheoff\nNotre Snapchat : http://www.snapchat.com/add/goldenmousnap\nCrédits :\n\nÉcrit par : Pierre Lapin & Le Pérave\n\nLa chaîne YouTube de Pierre Lapin : https://www.youtube.com/MrPierrelapin\nLa chaîne YouTube de Le Pérave : https://www.youtube.com/leperave\n\nMerci à L'Oréal de nous avoir permis de tourner cette vidéo ! \n\nAvec :\nHoria, dont voici la chaîne YouTube : https://www.youtube.com/user/UnMondeAuFeminin\n\nProducteur : Adrien Labastire\nResponsable de Golden Moustache : Younes Nemiche\nDirecteur de Création : Benjamin Ferel \nDirecteurs artistiques : Tarik Seddak, Aurélien Préveaux\nDirecteur de Production : Jérémy Bidaud \nResponsable de Production : Charlotte Thomas \nAdministrateurs de Production : Christophe Genre, Pierre Lorenzo\nChargé de production : Maxime Pontois\nStagiaires de Production : Laury Yildirim, Alex Bassetti\n\n\n1er Assistant Réalisateur : Julie Gobiet\nChef Opérateur : Garance Sanders\nRégisseur : Antoine Baril \n\nMaquilleuse/Coiffeuse : Ophélie Veret\n\nChargée de Post-Production : Tara Galy-Nadal, Chloé Pischedda\nStagiaires Post-Production : Alison Franco, Laura Figueiredo\nSon / Mixage : Florent Simon\nMontage : Eliott Doyle\nÉtalonnage : Florian Jarry \n\n\nGraphismes et vignette : Alexandre Breton, Marion Ducasse\n\nMoyens techniques : Golden Moustache, Cininter, Cicar, Florent Simon\n\nMusique : \nJelly Brain - Tom Quick (PRS) / Adam Drake (PRS)\nShowtime - David O'Brien (PRS) / Kevin Browne (PRS) / Johnny Lithium (PRS)\nCircus - Barrie Gledden (PRS) / Kes Loy (PRS)\nWhere's The Popcorn - David Tobin (PRS/BMI) / Jeff Meegan (BMI) / Huw White (PRS)\nBrainless Bruce - Tim Garland (PRS)\nChit Chat Polka - David Tobin (PRS/BMI) / Jeff Meegan (BMI) / Julian Gallant (PRS) / Rob Kelly (PRS) /  J Strauss ()\n \n\n \nRemerciements : \n\nPierre : Chloé Blondel\nLéopold : M.\n\n\n©GM6 - GOLDEN MOUSTACHE / Mars 2018",2018-03-10,2018-03-09,GAG DANS OREILLETTE AVEC HORIA AIME NOUS nNotre Twitter nNotre YouTube nNotre Dailymotion nNotre Instagram Snapchat dits n crit par Pierre Lapin Le rave nLa cha ne YouTube de Pierre Lapin cha ne YouTube de Le rave Or al de nous avoir permis de tourner cette vid n nAvec nHoria dont voici la cha ne YouTube Adrien Labastire nResponsable de Golden Moustache Younes Nemiche nDirecteur de Cr ation Benjamin Ferel nDirecteurs artistiques Tarik Seddak Aur lien Pr veaux nDirecteur de Production J my Bidaud nResponsable de Production Charlotte Thomas nAdministrateurs de Production Christophe Genre Pierre Lorenzo nCharg de production Maxime Pontois nStagiaires de Production Laury Yildirim Alex Bassetti n er Assistant alisateur Julie Gobiet nChef Op rateur Garance Sanders nR gisseur Antoine Baril nMaquilleuse Coiffeuse Oph lie Veret nCharg de Post Production Tara Galy Nadal Chlo Pischedda nStagiaires Post Production Alison Franco Laura Figueiredo nSon Mixage Florent Simon nMontage Eliott Doyle talonnage Florian Jarry n nGraphismes et vignette Alexandre Breton Marion Ducasse nMoyens techniques Golden Moustache Cininter Cicar Florent Simon nMusique nJelly Brain Tom Quick PRS Adam Drake PRS nShowtime David Brien PRS Kevin Browne PRS Johnny Lithium PRS nCircus Barrie Gledden PRS Kes Loy PRS nWhere The Popcorn David Tobin PRS BMI Jeff Meegan BMI Huw White PRS nBrainless Bruce Tim Garland PRS nChit Chat Polka David Tobin PRS BMI Jeff Meegan BMI Julian Gallant PRS Rob Kelly PRS Strauss n nRemerciements nPierre Chlo Blondel nL opold M n GM GOLDEN MOUSTACHE Mars GOLDEN MOUSTACHE HUMOUR DROLE RIRE BLAGUE PRANK COMEDIE OMG LE PERAVE PIERRE LAPIN HORIA,10
fEzuWWrYA4M,Hatim Idar - Banat dounia (Exclusive Music Video) | حاتم إدار - بنات الدنيا,Hatim Idar | حاتم إدار,10,"Hatim Idar|""حاتم إدار""|""حاتم ادار""|""Idar""|""حاتم ايدار""|""Idar Hatim""|""Hatem Idar""|""7atim Idar""|""Hatim Idare""|""Hatim""|""إعتزلت بنات الدنيا""|""اغاني مغربية""|""hatim idar""|""chr""|""يوتيوب اغاني""|""music mp3""|""youtube maroc""|""youtube music""|""Hatim Idar I3tazalto Banat Addounia""|""Hatim Idar 2018""|""حاتم إدار 2018""|""Idar 2018""|""Hatem Idar 2018""|""7atim Idar 2018""|""حاتم إيدار 2018""|""youtube music gratuite""|""mazika""|""hatim idar bye bye""|""tbghi lmacflure""|""mc flure""|""hatim idar nuttela""",5576035,0,0,حاتم إدار - بنات الدنيا (فيديو كليب) | 2018\nHatim Idar - Banat dounia (Exclusive Music Video) | 2018\n\nانضموا لقناة حاتم إدار الرسمية على يوتيوب وشاهدوا أحدث أعماله :\nhttp://goo.gl/52bUWZ\n\nتوزيع ديجيتال: شركة قنوات\n\nPost Production : eProd\n\nـــــــــــــ\nLike on Facebook: http://facebook.com/Idar.Fans\nFollow on Twitter : http://twitter.com/IdarOfficiel\nFollow on Instagram: http://instagram.com/HatimIdarOfficial\nOfficial iTunes: https://goo.gl/eSR9Mb\nFollow on Google+: https://goo.gl/XfQZoj\nwww.hatimidar.ma,2018-03-10,2018-03-09,Hatim Idar Banat dounia Exclusive Music Video nHatim Idar Banat dounia Exclusive Music Video n n n nPost Production eProd n nLike on Facebook on Twitter on Instagram iTunes on Google Hatim Idar Idar Idar Hatim Hatem Idar atim Idar Hatim Idare Hatim hatim idar chr music mp youtube maroc youtube music Hatim Idar tazalto Banat Addounia Hatim Idar Idar Hatem Idar atim Idar youtube music gratuite mazika hatim idar bye bye tbghi lmacflure mc flure hatim idar nuttela,10
RcPik8IivHY,4Keus Gang - La Vie De Reve,4KEUS GVNG OFFICIEL,22,"#mhd|""#orelsan""|""#lartiste""|""#lacrim""|""#booba""|""#kaaris""|""#vald""|""#marwaloud""|""#rk""|""#sch""|""#lorenzomamene""|""#sofiane""|""#maitregims""|""#blackm""|""#dadju""|""#maes""|""#gradur""|""#yl""|""#naps""|""#ninho""|""#graya""|""#q.afavelas""|""#timal""",823256,17113,1182,Péké - Le Black - Bouska - HK \n3eme Extrait de la Mixtape Hors Série V.2 \nActuellement disponible  :https://4KeusGang.lnk.to/LTP-single\n Instagram : https://www.instagram.com/4keus_gvng_... \nFacebook : https://www.facebook.com/4Keus-Gvng-O... \nTwitter : https://twitter.com/4keus_gvng \nRéalisation : Dabo Kadima \nProd by Naya Stark,2018-03-10,2018-03-09,Keus Gang La Vie De Reve k Le Black Bouska HK eme Extrait de la Mixtape Hors rie nActuellement disponible Instagram nFacebook nTwitter nR alisation Dabo Kadima nProd by Naya Stark mhd orelsan lartiste lacrim booba kaaris vald marwaloud rk sch lorenzomamene sofiane maitregims blackm dadju maes gradur yl naps ninho graya afavelas timal,10
K-Ehg6xT6fc,Sofiane - Lundi [Clip Officiel],Sofiane Officiel,10,"Sofiane|""Fianso""|""officiel""|""Blacklist 2""|""rap français""|""jesuispasséchezso""|""affranchis""|""lundi""|""bandit salete""",8022083,162748,4721,Abonne-toi → http://bit.ly/1X6nrpu\n\nNouvel Album AFFRANCHIS maintenant disponible : \nDigitale → https://sofiane.lnk.to/Affranchis\nPhysique → https://sofiane.lnk.to/Affranchis\n--\nAuteur SOFIANE\nCompositeur SEEZY\n \nRéalisateur Styck pour Daylight\nMontage Shems Cameron pour Daylight\n--\nRetrouvez Sofiane sur \nFacebook : https://www.facebook.com/fiansoofficiel\nTwitter : https://twitter.com/SofianeInm\nInstagram : Fiansolevrai,2018-02-20,2018-02-19,Sofiane Lundi Clip Officiel Abonne toi Album AFFRANCHIS maintenant disponible nDigitale SOFIANE nCompositeur SEEZY nR alisateur Styck pour Daylight nMontage Shems Cameron pour Daylight nRetrouvez Sofiane sur nFacebook Fiansolevrai Sofiane Fianso officiel Blacklist rap fran ais jesuispass chezso affranchis lundi bandit salete,10
LsoLEjrDogU,Bruno Mars - Finesse (Remix) [Feat. Cardi B] [Official Video],Bruno Mars,10,"Bruno Mars|""Finesse""|""Cardi B""|""Finesse Remix""|""Bruno""|""Mars""|""Cardi""|""official video""|""Pop""|""Hip hop""|""R&B""|""Atlantic Records""|""Atlantic""|""In Living Color""",74020654,2345874,97153,Finesse (Remix) Feat. Cardi B Available Now: https://Atlantic.lnk.to/FinesseRemixID\n\nDirected by Bruno Mars\nCo-Directed by Florent Dechard\nCreative Consultant - Phil Tayag\n\nDownload or stream 24k Magic: https://Atlantic.lnk.to/24K_MagicID\n\nSee Bruno on the ‘24K Magic World Tour’! Tickets on sale now. Visit http://brunomars.com for dates \n\nPick up the 24K Magic World Tour Collection in Bruno’s Official Webstore: https://brunom.rs/brunomarsstore\n\nConnect with Bruno:\nhttp://www.brunomars.com\nhttp://www.instagram.com/brunomars\nhttp://www.twitter.com/brunomars\nhttp://www.facebook.com/brunomars,2018-01-04,2018-01-04,Bruno Mars Finesse Remix Feat Cardi Official Video Finesse Remix Feat Cardi Available Now by Bruno Mars nCo Directed by Florent Dechard nCreative Consultant Phil Tayag nDownload or stream k Magic Bruno on the Magic World Tour Tickets on sale now Visit for dates nPick up the K Magic World Tour Collection in Bruno Official Webstore with Bruno Bruno Mars Finesse Cardi Finesse Remix Bruno Mars Cardi official video Pop Hip hop R Atlantic Records Atlantic In Living Color,10
RfhsZxLTyYE,Ninho x MHD - Bénéfice (Clip officiel),50 K Game Over,22,"ninho|""mhd""|""bénéfice""|""benefice""|""ninho ft mhd""|""ninho mhd""|""game over""|""compil game over""|""ninho feat mhd""|""ninho & mhd""|""ninho mhd benefice""",2553398,70651,2655,Premier single extrait de la compilation 'GAM€ OV€R’ pilotée par le Studio 50K\nBénéfice maintenant disponible ici : https://lnk.to/NinhoMHDbeneficesAY\n\nProd by rim's\nRéal by William Thomas\nRetrouvez toute l’actu  du label 50k sur Facebook : http://fb.me/50kEditions,2018-03-10,2018-03-09,Ninho MHD B fice Clip officiel Premier single extrait de la compilation GAM OV pilot par le Studio K nB fice maintenant disponible ici by rim nR al by William Thomas nRetrouvez toute actu du label k sur Facebook ninho mhd b fice benefice ninho ft mhd ninho mhd game over compil game over ninho feat mhd ninho mhd ninho mhd benefice,10
dq6G2YWoRqA,OrelSan - Tout va bien [CLIP OFFICIEL],orelsan,10,[none],5577245,212819,4544,La fête est finie : https://orelsan.lnk.to/LaFeteEstFinie \nLa tournée : https://orelsan.lnk.to/tour\n\nInstru : Stromae et Skread\nRéalisateurs : Greg & Lio \nProduction: Quad Productions\nProducteur exécutif : 23/32 \n\nInstagram : https://www.instagram.com/orelsan \nFacebook : https://www.facebook.com/orelsan \nTwitter : https://twitter.com/Orel_san\n\nRubik’s Cube® used by permission Rubik’s Brand Ltd.  www.rubiks.com,2017-11-16,2017-11-15,OrelSan Tout va bien CLIP OFFICIEL La te est finie nLa tourn Stromae et Skread nR alisateurs Greg Lio nProduction Quad Productions nProducteur ex cutif nInstagram nFacebook nTwitter Cube used by permission Rubik Brand Ltd www rubiks com none,10
283rflCSu0g,Gradur - Sheguey 12,GradurVEVO,10,"Gradur|""Sheguey""|""12""|""Millenium""|""Rap""|""Gradur Sheguey 12""|""Gradur Sheguey""|""Gradur Sheguey 12 clip""|""Gradur 12""|""Gradur Legevara""|""Gradur Shegueyvara""|""Gradur Sheygue""|""Gradur Sheyguey""|""Gradur clip""|""Gradur clip officiel""|""Gradur rap""|""Gradur new video""|""Gradur sheguey clip officiel""|""Gradur sheguey 12 clip officiel""|""sheguey""|""sheguey 12""|""sheguey 12 clip""|""sheguey 12 clip officiel""|""shegueyvara""|""legevara""|""gradi""|""grady""|""gradidur""|""gradur vevo""|""where""|""is""",7540110,166637,9441,Gradur - Sheguey 12\nDisponible sur iTunes et sur toutes les plateformes de streaming : \nhttps://Gradur.lnk.to/Sheguey12\n\nConnecte-toi avec Gradur :\nFacebook : https://www.facebook.com/Gradurog\nTwitter : https://twitter.com/GRADIDUR\nInstagram : https://www.instagram.com/gradurofficiel243,2018-02-24,2018-02-23,Gradur Sheguey Gradur Sheguey nDisponible sur iTunes et sur toutes les plateformes de streaming avec Gradur nFacebook Gradur Sheguey Millenium Rap Gradur Sheguey Gradur Sheguey Gradur Sheguey clip Gradur Gradur Legevara Gradur Shegueyvara Gradur Sheygue Gradur Sheyguey Gradur clip Gradur clip officiel Gradur rap Gradur new video Gradur sheguey clip officiel Gradur sheguey clip officiel sheguey sheguey sheguey clip sheguey clip officiel shegueyvara legevara gradi grady gradidur gradur vevo where is,10
44WiEYFopes,PRENDRE UNE PHOTO - NORMAN,NORMAN FAIT DES VIDÉOS,23,"norman|""norman fait des videos""|""video""|""vidéo""|""videos""|""vidéos""|""thavaud""|""photo""|""photographie""|""photographe""|""photographes""|""foto""|""fotos""|""tof""|""tofs""|""snap""|""snapchat""|""snap chat""|""insta""|""instagram""|""story""|""stories""|""storie""|""iphone""|""iphones""|""iphone x""|""comment""|""podcast""|""humour""|""drole""|""drôle""|""marrant""|""marant""|""funny""|""influenceur""|""influenceuse""|""influencer""|""selfie""|""selfi""|""selfies""|""shoot""|""shot""|""shooting""",4950208,342987,15864,"Prendre une photo c'est pas si facile...\n\nMerci à Paul Deby pour son acting : \nhttps://www.instagram.com/paulidy\nhttps://www.youtube.com/channel/UCXydFdIu44ZV34QGfiOfllA/\n\nMerci à la Galerie l'Univer pour son accueil : http://www.galerieuniver.com/\n\nMerci à Raphaël (rfj.chotard@gmail.com) pour la musique ! \nMerci à Anaïs, Blanche, David, Florian, Maxime et Stan !",2018-02-17,2018-02-16,PRENDRE UNE PHOTO NORMAN Prendre une photo est pas si facile nMerci Paul Deby pour son acting la Galerie Univer pour son accueil Rapha rfj chotard com pour la musique nMerci Ana Blanche David Florian Maxime et Stan norman norman fait des videos video vid videos vid os thavaud photo photographie photographe photographes foto fotos tof tofs snap snapchat snap chat insta instagram story stories storie iphone iphones iphone comment podcast humour drole dr le marrant marant funny influenceur influenceuse influencer selfie selfi selfies shoot shot shooting,10
2z3EUY1aXdY,Justin Timberlake’s FULL Pepsi Super Bowl LII Halftime Show! | NFL Highlights,NFL,17,"NFL|""Football""|""offense""|""defense""|""afc""|""nfc""|""American Football""|""highlight""|""highlights""|""sports""|""action""|""2017""|""2018""|""touchdown""|""td""|""AFC""|""NFC""|""champ""|""champion""|""championship""|""super bowl""|""super bowl 52""|""SB""|""new england""|""patriots""|""pats""|""eagles""|""philly""|""Justin Timberlake""|""halftime show""|""sexyback""|""sexy back""|""can’t stop the feeling""|""cry me a river""|""rock your body""|""filthy""|""singing""|""dancing""|""sp:dt=2018-02-04T18:30:00-05:00""|""sp:vl=en-US""|""sp:st=football""|""sp:li=nfl""|""sp:ti:home=NE""|""sp:ti:away=PHI""|""sp:ty=play""|""sp:or=9""",14219704,175336,55881,"Justin Timberlake breaks it down during the Pepsi Super Bowl LII Halftime Show. The Philadelphia Eagles take on the New England Patriots during Super Bowl LII.\n\nWatch full games with NFL Game Pass: https://www.nfl.com/gamepass?campaign=sp-nf-gd-ot-yt-3000342\n\nSign up for Fantasy Football! http://www.nfl.com/fantasyfootball\n\nSubscribe to NFL: http://j.mp/1L0bVBu\n\nThe NFL YouTube channel is your home for immediate in-game highlights from your favorite teams and players, full NFL games, behind the scenes access and more!\n\nCheck out our other channels:\nNFL Network http://www.youtube.com/nflnetwork\nNFL Films http://www.youtube.com/nflfilms\n\nFor all things NFL, visit the league's official website at http://www.nfl.com/\n\nWatch NFL Now: https://www.nfl.com/now\nListen to NFL podcasts: http://www.nfl.com/podcasts\nWatch the NFL network: http://nflnonline.nfl.com/\nDownload the NFL mobile app: https://www.nfl.com/apps\n2017 NFL Schedule: http://www.nfl.com/schedules\nBuy tickets to watch your favorite team:  http://www.nfl.com/tickets\nShop NFL: http://www.nflshop.com/source/bm-nflcom-Header-Shop-Tab\n\nLike us on Facebook: https://www.facebook.com/NFL\nFollow us on Twitter: https://twitter.com/NFL\nFollow us on Instagram: https://instagram.com/nfl/\nFind us on Snapchat",2018-02-05,2018-02-05,Justin Timberlake FULL Pepsi Super Bowl LII Halftime Show NFL Highlights Justin Timberlake breaks it down during the Pepsi Super Bowl LII Halftime Show The Philadelphia Eagles take on the New England Patriots during Super Bowl LII nWatch full games with NFL Game Pass up for Fantasy Football to NFL NFL YouTube channel is your home for immediate in game highlights from your favorite teams and players full NFL games behind the scenes access and more nCheck out our other channels nNFL Network Films all things NFL visit the league official website at NFL Now to NFL podcasts the NFL network the NFL mobile app NFL Schedule tickets to watch your favorite team NFL us on Facebook us on Twitter us on Instagram us on Snapchat NFL Football offense defense afc nfc American Football highlight highlights sports action touchdown td AFC NFC champ champion championship super bowl super bowl SB new england patriots pats eagles philly Justin Timberlake halftime show sexyback sexy back can stop the feeling cry me river rock your body filthy singing dancing sp dt sp vl en US sp st football sp li nfl sp ti home NE sp ti away PHI sp ty play sp or,10
kutk2XHEZNU,Vald - Désaccordé,VALDVEVO,10,"Vald|""Désaccordé""|""Millenium""|""Rap""|""vald désaccordé""|""vald""|""désaccordé""|""vald désaccorde""|""vald desacorde""|""Vald xeu""|""xeu vald""|""sofiane affranchis""|""sofiane""|""alkapote vald""|""alkapote""|""404billy""|""404billy tplc""|""kalash criminel""|""mac tyer""|""booskap""|""oklm""|""rapunchline""|""vald sofiane dragon""|""rapelite""",5126572,160816,5754,Vald - Désaccordé // Extrait de XEU disponible sur iTunes & toutes les plateformes de streaming: https://Vald.lnk.to/XEU\n\nCompositeur SEEZY\n\nClip réalisé par KUB et CRISTO pour SUTHER KANE FILMS\n\n\nConnecte toi avec Vald sur ses réseaux sociaux:\nhttps://www.facebook.com/VALDNQNT\nhttps://twitter.com/vald_ld\nhttps://www.instagram.com/valdsullyvan,2018-01-26,2018-01-25,Vald D saccord Vald D saccord Extrait de XEU disponible sur iTunes toutes les plateformes de streaming SEEZY nClip alis par KUB et CRISTO pour SUTHER KANE FILMS n nConnecte toi avec Vald sur ses seaux sociaux Vald saccord Millenium Rap vald saccord vald d saccord vald saccorde vald desacorde Vald xeu xeu vald sofiane affranchis sofiane alkapote vald alkapote billy billy tplc kalash criminel mac tyer booskap oklm rapunchline vald sofiane dragon rapelite,10
AisWm_niafc,Rohff - Détrôné ft NEJ' [Clip Officiel],Rohff,10,"Rohff|""Surnaturel""|""Distinct""|""nej""|""detrone""|""détrôné""|""roh2f""|""sntl""|""rohff feat nej""",5487653,60609,12543,Clip Officiel de Rohff - Détrôné ft NEJ'\nDisponible sur toutes les plateformes : https://rohff.lnk.to/Detrone\nAbonne-toi à la chaîne : http://bit.ly/2lWnCcB\n\nPlus d'infos :\nSnapchat : https://www.snapchat.com/add/realrohff\nFacebook : https://www.facebook.com/OfficielRohff\nTwitter : https://twitter.com/rohff?lang=fr\nInstagram : https://www.instagram.com/surnaturelbyrohff/\n/,2017-12-15,2017-12-14,Rohff D tr ft NEJ Clip Officiel Clip Officiel de Rohff D tr ft NEJ nDisponible sur toutes les plateformes la cha ne infos nSnapchat Rohff Surnaturel Distinct nej detrone d tr roh sntl rohff feat nej,10
ZUNOiNjDsc4,"Vegedream, Dj Leska - La fuite",VegedreamVEVO,10,"Vegedream|""Dj""|""Leska""|""La""|""fuite""|""Casablanca""|""Urban""|""la synesia""|""Synesia""|""Vegedream de Gagnoa""|""Gagnoa""|""dadju""|""la fuite""|""Tracka""|""Trackabanbang""|""Jayci Chalonec""|""Elonie Lopes""|""Gaelle Falzerane""|""Salma Moulim""|""Tonio Life""|""Mr Nouar""|""Babz19""|""Anthony Pho""|""Willaxxx""|""Noah Lunsi""|""Hakim Jemili""|""Florian Nguyen""|""Melina Charles""|""Alex Levand""|""Mouv""",628638,21962,505,"La Fuite titre disponible ici : https://vegedream.lnk.to/lafuite\nAbonne-toi à la chaine → http://po.st/VegedreamVEVO \n\nSuis l'actualité de Vegedream sur :\nFacebook : https://www.facebook.com/VegedreamOfficiel/\nInstagram : https://www.instagram.com/vegedream/\nTwitter : https://twitter.com/VegedreamGagnoa \nSnapchat : https://www.snapchat.com/add/vegedream\n\nMerci à :\nTracka, Jayci Chalonec, Elonie Lopes, Gaelle Falzerane, Salma Moulim, Tonio life, Mr Nouar, Babz19, Anthony Pho, Willaxxx, Noah Lunsi, Hakim Jemili, Florian Nguyen, Melina Charles, Alex Levand\n\nVideo Director: TRACKABANGBANG\n\nMusic video by Vegedream, Dj Leska performing La fuite. (C) 2017 Together Publishing / MCA, a label of Universal Music France\n\nhttp://vevo.ly/gJ4tRd",2018-03-10,2018-03-09,Vegedream Dj Leska La fuite La Fuite titre disponible ici la chaine n nSuis actualit de Vegedream sur nFacebook nSnapchat nTracka Jayci Chalonec Elonie Lopes Gaelle Falzerane Salma Moulim Tonio life Mr Nouar Babz Anthony Pho Willaxxx Noah Lunsi Hakim Jemili Florian Nguyen Melina Charles Alex Levand nVideo Director TRACKABANGBANG nMusic video by Vegedream Dj Leska performing La fuite C Together Publishing MCA label of Universal Music France n Vegedream Dj Leska La fuite Casablanca Urban la synesia Synesia Vegedream de Gagnoa Gagnoa dadju la fuite Tracka Trackabanbang Jayci Chalonec Elonie Lopes Gaelle Falzerane Salma Moulim Tonio Life Mr Nouar Babz Anthony Pho Willaxxx Noah Lunsi Hakim Jemili Florian Nguyen Melina Charles Alex Levand Mouv,10
P3Bd3HUMkyU,First Look at Nintendo Labo,Nintendo,20,"nintendo|""play""|""play nintendo""|""game""|""gameplay""|""fun""|""video game""|""kids""|""action""|""adventure""|""rpg""|""DIY""|""Nintendo Switch""|""Switch""|""RC Car""|""Joy-Con""|""cardboard""|""creations""|""Make""|""Play""|""Discover""|""piano""|""robot""|""music""|""fishing""|""fishing pole""|""do it yourself""|""race car""|""kit""|""customize""|""robot kit""|""toy-con""|""motorcycle""|""build-and-play""|""stencil""|""sticker""|""tape""|""variety kit""|""craft""|""crafting""",15130674,370061,48165,"Get ready to Make, Play and Discover with Nintendo Labo! Nintendo Labo is a new line of interactive build-and-play experiences that combine DIY creations with the magic of Nintendo Switch. Available on April 20, 2018! \n\nLearn more about Nintendo Labo here: https://labo.nintendo.com\n\n#NintendoLabo #NintendoSwitch\n\nSubscribe for more Nintendo fun! https://goo.gl/09xFdP\n\nVisit Nintendo.com for all the latest! http://www.nintendo.com/\n\nLike Nintendo on Facebook: http://www.facebook.com/Nintendo\nFollow us on Twitter: http://twitter.com/NintendoAmerica\nFollow us on Instagram: http://instagram.com/Nintendo\nFollow us on Pinterest: http://pinterest.com/Nintendo\nFollow us on Google+: http://google.com/+Nintendo",2018-01-18,2018-01-17,First Look at Nintendo Labo Get ready to Make Play and Discover with Nintendo Labo Nintendo Labo is new line of interactive build and play experiences that combine DIY creations with the magic of Nintendo Switch Available on April n nLearn more about Nintendo Labo here NintendoLabo NintendoSwitch nSubscribe for more Nintendo fun Nintendo com for all the latest Nintendo on Facebook us on Twitter us on Instagram us on Pinterest us on Google nintendo play play nintendo game gameplay fun video game kids action adventure rpg DIY Nintendo Switch Switch RC Car Joy Con cardboard creations Make Play Discover piano robot music fishing fishing pole do it yourself race car kit customize robot kit toy con motorcycle build and play stencil sticker tape variety kit craft crafting,10
3BXDsVD6O10,Eminem - River (Audio) ft. Ed Sheeran,EminemVEVO,10,"Eminem|""Eminem 2017""|""New Eminem""|""New Eminem 2017""|""Eminem Ed Sheeran""|""Eminem Ed Sheeran Collab""|""Eminem River""|""Ed Sheeran River""|""Eminem Ed Sheeran River""|""River ft Ed Sheeran""|""Revival""|""Eminem Revival""|""Revival 2017""|""Eminem single""|""Eminem single 2017""|""Eminem Songs""|""Eminem album""|""Eminem all songs""|""River""|""Aftermath/Shady/Interscope""|""Rap""",28995235,1118923,23872,"Eminem's track River ft. Ed Sheeran is available on the album 'Revival,' out now: http://shady.sr/Revival\n \nFor more visit: \nhttp://eminem.com\nhttp://facebook.com/eminem\nhttp://twitter.com/eminem\nhttp://instagram.com/eminem\nhttp://eminem.tumblr.com\nhttp://shadyrecords.com\nhttp://facebook.com/shadyrecords\nhttp://twitter.com/shadyrecords\nhttp://instagram.com/shadyrecords\nhttp://trustshady.tumblr.com\n\nMusic video by Eminem performing River. (C) 2017 Aftermath Records\n\nhttp://vevo.ly/gi8kWE",2017-12-15,2017-12-15,Eminem River Audio ft Ed Sheeran Eminem track River ft Ed Sheeran is available on the album Revival out now nFor more visit n video by Eminem performing River C Aftermath Records n Eminem Eminem New Eminem New Eminem Eminem Ed Sheeran Eminem Ed Sheeran Collab Eminem River Ed Sheeran River Eminem Ed Sheeran River River ft Ed Sheeran Revival Eminem Revival Revival Eminem single Eminem single Eminem Songs Eminem album Eminem all songs River Aftermath Shady Interscope Rap,10
